Category,Message,real
1,"US offers assurances to Sweden, Finland over NATO application https://ift.tt/Q2L5XK6",1
1,Inflation in Turkey soars to eye-popping near 70 percent in April https://ift.tt/EKXoptR,1
1,"Teenaged rape survivor raped again in UP police station, SHO arrested https://ift.tt/FP35JQE",1
1,Apology from Russia to Israel?? Maybe. https://ift.tt/dEzGx5a,1
1,South Korea&#39;s Intelligence Agency Has Joined NATO&#39;s Cyber Defense Unit. China Isn&#39;t Happy https://ift.tt/QswVCT1,1
1,Pope Francis authorized €1 million to free kidnapped nun https://ift.tt/muEOQ9I,1
1,EU&#39;s Charles Michel vows to increase Moldova support https://ift.tt/caNk9Sp,1
1,Oil edges up on supply jitters as EU plans Russian oil ban https://ift.tt/jmeDC7v,1
1,US provided intelligence that helped Ukraine target Russian warship https://ift.tt/kN40rwC,1
1,Russia has already fired more than 2000 missiles on Ukraine https://ift.tt/rxuTjei,1
1,US Govt seizes oligarchs yacht anchored in Fiji https://ift.tt/QABNZRi,1
1,US provided intelligence that helped Ukraine sink Russian warship https://ift.tt/ezh3nZG,1
1,"US Intelligence Helped Ukraine Strike Russian Flagship, Officials Say https://ift.tt/rGL4WUY",1
1,China Officials warned not to challenge the country&#39;s zero-Covid policies https://ift.tt/DAQgZu3,1
1,Shanghai&#39;s exit from lockdown delayed by new COVID-19 cases https://ift.tt/N1l3wE4,1
1,Russian State Media Claims to Discover Militarized Ukrainian Witches https://ift.tt/lpQNqe9,1
1,"Covid-19&#39;s full death toll is nearly three times higher than reported, WHO data suggests https://ift.tt/bPDxJco",1
1,A Russian soldier who was in Bucha during the executions was identified because he spray-painted his Instagram handle in a civilian&#39;s home https://ift.tt/cZSpAkE,1
1,Chechen Leader&#39;s Brutal Fighters Are Getting Killed in Ukraine &#39;Every Day&#39; https://ift.tt/T5DI4rb,1
1,"Russians steal vast amounts of Ukrainian grain and equipment, threatening this year&#39;s harvest https://ift.tt/SXwv86i",1
1,Israel ax attack leaves multiple injured in Tel Aviv suburb El&#39;ad https://ift.tt/I03EYbr,1
1,Former Zelenskyy Aide: Global Attention on Ukraine &#39;Getting Stronger&#39; https://ift.tt/ty4NExB,1
1,Israel&#39;s PM says Putin has apologised for Lavrov&#39;s Hitler remarks https://ift.tt/qZBJgIh,1
1,"Three killed, four wounded in attack near Tel Aviv, medics say https://ift.tt/0TWYX42",1
1,Russia &#39;practising with nuclear weapons&#39; in chilling war games. Moscow has confirmed Russian troops have been practising nuclear missile strikes close to NATO nations&#39; borders https://ift.,1
1,Hundreds of Iraqis hospitalised as thick sandstorm blankets country https://ift.tt/E0YexqH,1
1,US plans to counter China &#39;at risk because of allies&#39; reluctance to host missile systems&#39; https://ift.tt/o6PAx0l,1
1,"&#39;Grotesque&#39; Mariupol parade: Azovstal soldiers fear capture, caging as part of spectacle on Russia&#39;s Victory Day Parade https://ift.tt/L51sTDN",1
1,Officials push back on report US intel helping Ukraine target Russian generals https://ift.tt/oZ7pK4v,1
1,FDA puts strict limits on Johnson &amp; Johnson Covid-19 vaccine https://ift.tt/6v4HcDT,1
1,Myanmar military incinerates entire village in southern Kalay https://ift.tt/hfYJ83R,1
1,Swiss police seize 500kg of cocaine at Nespresso factory | Switzerland https://ift.tt/TReKJE1,1
1,Pentagon Says US Is Not Providing Ukraine Info To Kill Russian Generals https://ift.tt/qludxkI,1
1,Russia&#39;s Most Advanced Tank in Service Destroyed After Days: Reports https://ift.tt/80aylAL,1
1,Potentially abusive men are using a UK scheme to host Ukrainian refugees - to contact vulnerable women https://ift.tt/9oJ7jV4,1
1,"US Targeting Data Helped Ukraine Strike Russian Flagship, Officials Say https://ift.tt/SNOW49E",1
0,Even my favorite game suffers from this https://ift.tt/dC9XYui,0
0,Greatest Warzone Win!!! #shorts https://youtube.com/shorts/mJb0Q1SduBk?feature=share,0
0,What video game character can you not stand? I can think of several characters off the top of my head. Most are from RPGs.,0
0,What are some of the most complete documentaries on the history of video games? Including console and PC No text found,0
0,when was the last time you made upgrades to your gaming computer? i just got a new graphic card for my main gaming computer now i already want to make other ugprades,0
1,Emerson Electric is exiting Russia https://ift.tt/FCEQ24w,1
1,Électricité de France(EDF) is exiting Russia https://ift.tt/JdL3UrE,1
1,Germany begins filling western Europe&#39;s biggest gas storage site https://ift.tt/BVx925N,1
1,Indian opposition seeks higher compensation for COVID deaths after damning WHO report https://ift.tt/m5kKSXi,1
1,Xi Jinping sends warning to anyone who questions China&#39;s zero-Covid policy https://ift.tt/fD5NsGm,1
1,Britain&#39;s Conservatives confident on N. Ireland&#39;s future in UK https://ift.tt/TRQJsjv,1
1,DP selects ex-presidential candidate Lee Jae-myung as candidate for parliamentary by-election https://ift.tt/NLn4DPx,1
1,Japan alarmed by China&#39;s ADIZ sorties: Japanese lawmaker https://ift.tt/5D8sjIc,1
1,Xi Jinping says China&#39;s Covid policies will &#39;stand the test of time&#39; in Shanghai https://ift.tt/5eS1u0p,1
1,Elad terror attack: Ax killings leave 16 children fatherless https://ift.tt/UZaXCBw,1
1,Pope says NATO may have caused Russia&#39;s invasion of Ukraine https://ift.tt/7LzDfCZ,1
1,"Pro-Russia convoy organisers discuss violence, guns in closed group chat. https://ift.tt/GQPB6wJ",1
1,Iraqis choke under a blanket of dust as sandstorms sweep the country https://ift.tt/mj3QC0P,1
1,UK local elections 2022: Labour victorious in Wandsworth as Tories lose control of flagship council. The south London council had been held by the Conservatives for more than forty years. https://ift.,1
1,"Lukashenko - &quot;Thanks to yours truly, me that is, negotiations between Ukraine and Russia have begun.” https://ift.tt/Zqk7h2i",1
0,"I need help remembering the name of a game. It was a free roam game on the Xbox 360/PS3, around the 2010s I believe. You would start/spawn at the mansion and at the fron there was a bridge over a moat",0
0,Pokemon GSC Switch How cool would it be if the Gold/Silver/Crystal versions were released either through an emulator or a port of the SS/HG games of the DS on switch. I have a switch and don&#39;t have,0
0,"What are your comfort games? Games you through on whenever you&#39;re sad, feeling sick or just needing company? Mine are Mass Effect or any Yakuza games",0
0,"My favorite voice actor, Who is your favorite? https://ift.tt/BHwx2mz",0
0,"How do i make soundproof room for Gaming and stuff? As the title said, i don&#39;t want my family knows that im gaming inside my room, but i also didn&#39;t want to use a Headset so i still can heard",0
0,I&#39;m working on my dream game where you can fly into a black hole https://ift.tt/FG07HA3,0
0,Need a Game and some tips? I am not working currently however I do plan on working soon. Is a PS5 worth it? I&#39;m tired of having boring and ugly 30fps on my PS4. I really want a consistent 60 frames,0
0,Why do people like League of Legends? Is there something I&#39;m missing here? I&#39;ve watched gameplay before and it looked extremely boring so I didn&#39;t touch it for years. Recently after,0
0,"Trying to remember the name of this weird old (I think) browser game? I remember in ancient times, elementary school, so sometime in between 2006-2009, this weird game I used to play. There were these",0
0,"What sports game should I play I have game pass ultimate and I&#39;ve never really played any sports games so I&#39;m wondering what I should start off with ( I&#39;m talking like 2k , Nhl games like",0
0,Found a skylander trapped in this game at a movie theater I visited https://ift.tt/gV0jALQ,0
0,"Glitchy Monday Discussion So, let&#39;s talk about Glitches that you, Gamers, experienced in games you recently played, glitches that it wasn&#39;t a big deal up to glitches that prevent you from",0
0,"DON&#39;T DO DEV EXITS, KIDS! - Rate Your Level #3 https://youtu.be/PZ3taDgT3-Q",0
0,What are your top nitpicks of otherwise excellent games that you love? No text found,0
0,"Has online multiplayer stifled AI progress in gaming, or what did? Maybe I&#39;m wrong, but it seems like NPC&#39;s AI in games has not improved much in years. I rarely see them do anything interesting",0
0,"What&#39;s your hottest gaming take? I&#39;ll go first. Insomniac&#39;s Spider-Man was a good game, but no where near the level of greatness that many fans say it is.",0
0,What do you guys think?? is the clearance enough? (for air coming in and out ) https://ift.tt/b9MZy45,0
0,The TF2 Community needs your help https://m.youtube.com/watch?v=53WkDZQADIk,0
0,Okay final build. Is this all compatible and good? 3080 white build Okay all white build ready to go on Amazon about to buy. ANYTHING I&#39;m missing? Does it look good? All compatible? https://,0
0,just got Jedi:Fallen Order and Naruto UNS4 yesterday. And man I&#39;m happy with this. https://ift.tt/TBKzj5E,0
0,"PS4 Recs for Different Tastes? My brother just got a ps4 and I&#39;d like to find some games for us to play together, except we have fairly different tastes. He enjoys games like Genshin Impact,",0
0,Went home for Mother&#39;s day and brought my old game collection back. Here is a fraction of my collection: Gamecube. https://ift.tt/x62OEo1,0
0,"Anyone else have this issue? Gaming and sleep Usually my gaming time is at night once the wife and kids are down. Start somewhere between 8 and 9. Lately though, anytime I game at night I have a hard",0
0,this is for you wireless mouse gammers hear me put but what if your wireless mouse charger was the mouse pad?,0
0,Old Windows game compatibility in Windows 10 I found a link that shows many tricks to make some old Windows 95/98 games to work on Windows 10. Are there any other sites with tips? I am trying to run,0
0,Are there any games based on animes that you really enjoyed? A lot of anime/manga inspired games have come out and I never hear any real praise…,0
0,what was your graphic card up grade journey like? for me it was started in the early 2010s with the 480 &gt; 560 &gt; 580 &gt; 1660 super &gt; 1080ti &gt; 2080Ti &gt; 3070 &gt; 3080 &gt; now 3090,0
0,SNES Game Quiz! https://www.youtube.com/watch?v=klvXTrEb53E,0
0,What&#39;s a rare game in your collection that you own? For me it&#39;s death jam fight for New York ps2 version.,0
0,Looking for forgotten game... Hey everyone! Several years ago I got into a very lively discussion with my Uber driver (spurred by our shared obsession with soundtrack music and mythology) and he,0
0,The Wacky World of Speedruns &amp; Challenge Runs https://www.youtube.com/watch?v=xy_QZh-oihk&amp;ab_channel=Cleb,0
0,"Mario, forcing Toads to interact with others since 1983. https://ift.tt/F8NQbSe",0
0,What is a gaming sin you have committed? I&#39;ll start. I have 2 actually: Even after playing more than 200 hours of The Witcher 3 (back at release) I have never ever played the DLCs. I have them but,0
0,The lack of an autosave in Shin Megami Tensei V is disgusting on an otherwise stellar game. It isn&#39;t 1995 anymore. Make an autosave damnit.,0
0,"best pink gaming headphones? Let`s be honest, razers are cute but not quality. Looking for big headphone cup bc the others hurt my industrial. Suggestions pls!! No text found",0
0,Or maybe I&#39;m just bad at Super Mario Galaxy…. https://ift.tt/tPuwDpe,0
0,"This&#39;ll be you guys in about 20 years. (YES, I CAN GUESS HOW OLD YOU ARE!) https://ift.tt/WDNQzxC",0
0,"Hey there Reddit! I&#39;ve been working on this piece for around 6 months, and I&#39;ve finally finished it! Yes, it&#39;s based off the concept art for Doom Eternal, but I hope you enjoy it regardless",0
0,"i need a list of games unfortunately, i am only 1 person with limited gaming knowledge but i&#39;m looking for a game, any game, that has the following a top-down view (preferably 3/4 perspective/",0
0,TIL that Pong actually had no code and was all done via hardware (original schematic in pic) https://ift.tt/h27k5pF,0
0,"Any game recommendations where you fly/play a bird? As a kid, I used to play Guardians of Ga&#39;Hoole on the Wii. I loved the flying in it and want a similar experience",0
0,Is there a way to get around cross-play? I&#39;m trying to play elden ring with my friend I am on Xbox and he is on pc. I am wondering if there is any way to register my Xbox as a pc or something like,0
0,LEGO™ Lord of the Rings™ got no right to look as good as it does https://ift.tt/lgw7kzD,0
0,"What&#39;s the funniest moment in gaming for you? Personally, I&#39;ll have to go with the Romeos and Juliets play in Nier Automata",0
0,Chair recommendations I&#39;m looking to get my other a gaming chair for his birthday. I&#39;ve looked at a few but I&#39;m not sure which one is best. Any recommendations? He plays for a long amount,0
0,"What console should I get? So I&#39;m open to handheld suggestions but I guess the switch is also being considered. Im a gamer. I have a original SNES, N64, gba, Ds, ps1&amp;2, xbox360, GameCube(had a",0
0,"Disco Elysium Makes Smoking The Coolest Thing, And Is Better For It Hello, I&#39;m Gate28, I&#39;m 30 and a smoker, and I&#39;m late to the Disco Elysium train. I think it&#39;s interesting the way",0
0,Do you own the Orange Box on xbox? Time for a Red Hot TF2 Revival! Bored playing the same games over and over on xbox? Me too. You know what I miss really bad? Some good Ol&#39; fashioned vanilla Team,0
0,Keyboard acting funny When I press and hold control key. Both the W and the S keys no long work until I let go of control key. This happens both while playing games and while doing normal stuff like,0
0,Would you pay to play a multiplayer game? Why or why not? No text found,0
0,I need game suggestions Any suggestions of games to play?,0
0,Just bought myself a ps vita so this is how I feel after looking at my bank account https://ift.tt/upCw2hI,0
0,"Nintendo Switch controllers suck Why is it so complicated every time I want to play a game? I have the controllers that came with it , along with 2 PlayStation style controllers. Each time I turn on",0
0,Am I the only one who recognizes this game? ​ https://i.redd.it/xzch5s0vlcy81.gif,0
0,"Group of friends looking for game We are a group of 8-15 friends looking for a game for playing together, looking for something like minecraft, seven days and so.",0
0,I&#39;d play this if it was a real game. Just Cause/Dying Light https://ift.tt/IQGPdig,0
0,I returned with another free game code dead space 2 on origin https://ift.tt/tnNm5qF,0
0,What game was first to have decision based gameplay? No text found,0
0,Here&#39;s a question: what made you decide to buy your past/present consoles? Why did you go PlayStation above xbox? Why have you ignored those and stuck with Nintendo/PC etc? Was it because of the,0
0,FromSoftware Give me your FromSoftware games ranking from best to worst.,0
0,FOR THOSE WHO KNOW: Has the bug on GTAIV for the next-gen (XBOXOne backwards compatibility) been fixed for one of the final missions? For those who are aware of or know about a or THE bug or bug(s) on,0
0,Anyone remember an old ps3 game? I don&#39;t really remember the games name but it was a parkour game with magma spiders or something and it was set in New York. The start of the game had you near a,0
0,"What games are best played blind (no prior knowledge)? Personally, I&#39;d say Outer Wilds (~20hr) and Mother 3 (~30 hr) Edit: I know all games are best played blind but some benefit from it more than",0
0,"Coop games So me and my friend love to play coop games together so obviously we&#39;ve done the great ones such as wasteland 3, portal 2, don&#39;t starve and many others but we&#39;re looking for more",0
0,"I earned my first platinum trophy on PS4 today. I know it&#39;s a relatively small achievement, but it&#39;s mine https://ift.tt/xXSrMbP",0
0,Xbox controller won&#39;t connect to PC but will connect to phone today I bought an Xbox controller to use on my Chromebook (i know it&#39;s crappy but I unfortunately don&#39;t have anything else) I,0
0,Found some of my old PC games from childhood. https://ift.tt/aGQm75v,0
0,Where can i get a copy of bookworm adventures 2 deluxe that game was my childhood No text found,0
0,"my favourite game is the ps4 god of war, I got it on pc and these are some of my favourite pictures from my playthrough, would love to know what everyone thinks https://ift.tt/pY7IfcJ",0
0,"Fantasy adventure RPG recommendations? I was watching some anime (goblin slayer, is it wrong to pick up girls in a dungeon, and sword art online) and it got me thinking. Are there any games out there",0
0,Homemade switch tabletop charging solution https://ift.tt/SQHFZ6o,0
0,A Jigglypuff card I filled in awhile ago https://ift.tt/K4uhUXC,0
0,Thank God for female video game sellers on Offer Up and FBMP No text found,0
0,"Any way to avoid the PS3 Yellow Light Of Death issue I want to replace my PlayStation 2 with a PlayStation 3 cuz I want to play 7th generation games. But, I still want to play Grand Theft Auto: III,",0
1,Sixty feared dead in bombing of Ukraine school; G7 condemns Putin https://ift.tt/ZReNj5z,1
1,North Iraq violence displaces Yazidis once again https://ift.tt/m2Bpj6F,1
1,Scholz defends Ukraine stance as voters punish muddled policy https://ift.tt/JLvoM9A,1
1,Strong voter turnout in Philippines as Marcos targets presidency. https://ift.tt/lGTUBQX,1
1,Ukraine refugees in UK face waits of up to two years for war trauma therapy https://ift.tt/15HEv7N,1
1,"Fueling Secession, Promising Bitcoins: How a Russian Operator Urged Catalonian Leaders to Break With Madrid - OCCRP https://ift.tt/K1RaDU8",1
1,Shanghai lockdown is a test of Xi Jinping loyalties within the CCP https://ift.tt/jeoI2Qd,1
1,"EU should seize Russian reserves to rebuild Ukraine, top diplomat says https://ift.tt/aPZrFmC",1
1,"Knesset reopens with coalition teetering, opposition seeking to bring down gov&#39;t https://ift.tt/GsEHXIx",1
1,Elon Musk Fears for His Life After Russian Threats https://ift.tt/y6NuzOV,1
1,Israel considering military op in Jenin or Gaza in response to terror wave - reports https://ift.tt/h7pSX08,1
1,Report: German Airline Refuses To Fly Jews After Various Passengers Refused To Wear Masks https://ift.tt/6rUzwEB,1
1,"Russian bomb rips through school in Ukraine, kills at least 60: Ukrainian officials https://ift.tt/DAdBtQ1",1
1,"EU should seize Russian reserves to rebuild Ukraine, Borrell says - FT https://ift.tt/semtRrx",1
1,Elon Musk Sounds The Alarm About Japan https://ift.tt/O6tSgwr,1
1,UN agency chief resigns after probe into its investments https://ift.tt/5jxQspt,1
1,Explainer: What&#39;s at stake in the Philippines election? - Times of India https://ift.tt/DCFLKTJ,1
1,India delivers 40000 MT petrol to Sri Lanka for free https://ift.tt/EDSj0kC,1
1,putin: Putin&#39;s actions in Ukraine &#39;bring shame on Russia&#39;: G7 statement - Times of India https://ift.tt/cQnLBkC,1
1,Russia says no nuclear intentions for Ukraine - Times of India https://ift.tt/pAMdGN0,1
1,ukraine: Putin to mark Soviet WW II victory as Ukraine decries school bombing - Times of India https://ift.tt/tMU9ifP,1
1,There are only 10 of the world&#39;s smallest marine mammal left in the world https://ift.tt/17tLmZW,1
1,"Russia readies massive Victory Day parade, seeking to legitimize war with Ukraine https://ift.tt/7JLkgpG",1
1,"Terror wave: Infiltration of Tekoa thwarted, stabbing at Damascus Gate https://ift.tt/0fo3ZVB",1
1,The Ministry of Internal Affairs of Ukraine says it has already received a total of about 32000 appeals in which the relatives of Russian soldiers who had gone missing in the war with Ukraine ask about,1
1,Syrian president meets Iranian leader in Tehran https://ift.tt/EycigL3,1
1,Mexican couple hosted Nazi-themed wedding on Hitler&#39;s anniversary https://ift.tt/WDvPBx0,1
1,"Thousands of people gathered in central Warsaw on Sunday to protest Russian aggression in Ukraine. The crowd marched from the Palace of Culture and Science to the Russian Embassy, ​​chanting slogans in",1
1,"New UK sanctions against Russia, Belarus target $2 billion worth of trade https://ift.tt/8Fyka4e",1
1,Lockheed Martin to ramp up javelin missile production amid Ukraine war https://ift.tt/YOTmhBW,1
1,Ukrainian teen with gunshot wounds drives 4 people to safety during Russian attack https://ift.tt/mMFysHW,1
1,"Mysterious death in Russia of ANOTHER oligarch, this time from a hangover. The former top manager of Lukoil treated a hangover with a shaman. https://ift.tt/h3Y9qeJ",1
1,Tighter Curbs in Shanghai Even as COVID Cases Fall https://ift.tt/60UkJoW,1
1,"Israeli PM Bennett cuts on settler housing plans to appease US, coalition members https://ift.tt/uCr9Z1B",1
1,"Saudi, Indian naval exercise heralds new era in ties https://ift.tt/QMpZrbK",1
1,Ukraine war: First ladies meet as US announces new sanctions. Jill Biden in Ukraine. https://ift.tt/96jgNwb,1
1,"/r/WorldNews Live Thread: Russian Invasion of Ukraine Day 75, Part 1 (Thread #215) https://ift.tt/ZMgWXKc",1
1,UFOs are &#39;not a delusion&#39; as Pentagon releases papers on exposure effects https://ift.tt/DWbIgc0,1
1,India Shelves ₹35000 Cr Plan To Upgrade Su-30 Fighter Fleet Amid Russia-ukraine War https://ift.tt/ndKLhCG,1
1,Putin to mark Soviet WW2 victory as Ukraine decries school bombing https://ift.tt/7kbAeMH,1
1,China says it conducted exercises near Taiwan https://ift.tt/B8ADdOa,1
1,Putin to mark Soviet WW2 victory as Ukraine decries school bombing https://ift.tt/FKiaXL7,1
1,Google begins to block accounts of State Duma deputies under sanctions https://ift.tt/APJfj7H,1
1,Putin Wishes WWII Vets in Ukraine &#39;Long Life&#39; But Continues Deadly Attacks https://ift.tt/jL1GOpx,1
1,Trudeau says Putin responsible for &#39;heinous war crimes&#39; during surprise visit to Ukraine - National https://ift.tt/BFC9MRj,1
1,"Russian space agency chief boasts nuclear capabilities, claims NATO would lose &#39;in 30 minutes&#39; https://ift.tt/ZkI7Pn0",1
1,"Japan to slowly phase out Russian oil, keep interests in projects https://ift.tt/YNwxiTA",1
1,Israel army shoots Palestinian while crossing from West Bank https://ift.tt/jnMdZ2J,1
1,PQ rejects calls to boost Quebec&#39;s immigration levels https://ift.tt/TcuDvwj,1
1,Philippines election: Marcos family eye return to power as country votes https://ift.tt/gxV8YlG,1
1,"Putin&#39;s actions in Ukraine bring shame on Russia, says G7 https://ift.tt/G12ZxnM",1
1,Japan to ban Russian oil imports &#39;in principle&#39; -PM Kishida https://ift.tt/d9eCrvW,1
1,"Putin&#39;s &#39;fascism and tyranny&#39; equal to Nazis, Ben Wallace says. https://ift.tt/3KA6Qjh",1
1,Trudeau: Canada to be good energy partner with Europe but won&#39;t compromise climate goals https://ift.tt/IxVYzRq,1
1,Turks and Caicos legislators support BVI&#39;s call for no &#39;UK direct rule&#39; https://ift.tt/0HOLB7A,1
1,Twelve people killed in Burkina Faso ambush attack. https://ift.tt/LzwXpU8,1
1,Syria&#39;s Assad meets Iran&#39;s Supreme Leader in Tehran https://ift.tt/OSna9l3,1
1,Justin Trudeau makes surprise visit to Ukraine https://ift.tt/a35wRNc,1
1,"Putin&#39;s &#39;fascism and tyranny&#39; equal to Nazis, Ben Wallace says https://ift.tt/3KA6Qjh",1
1,"Canadians being targeted by intel services linked to China, Russia: Report | World News https://ift.tt/qzKjD30",1
1,Canada&#39;s Trudeau announces new weapons for Ukraine in visit to Kyiv https://ift.tt/7hCtBMV,1
1,Is Nato&#39;s Nordic expansion a threat or boost to Europe? https://ift.tt/CAh2zRm,1
1,Dictator&#39;s son a front-runner as Filipinos elect next leader https://ift.tt/pKIPWqG,1
1,"&#39;Stop asking why&#39;: Shanghai tightens COVID lockdown, Beijing keeps testing. https://ift.tt/RpGPYBk",1
1,Scholz vows to continue sending heavy weapons to Ukraine https://ift.tt/SapyXzb,1
1,"&#39;Some Faint, Some Die&#39;: These People Are Living Through the World&#39;s Worst Heat Wave https://ift.tt/J4q7oOM",1
1,"Ukraine will prevail as Europe did in 1945, Scholz to say in VE Day speech https://ift.tt/7xtdz9n",1
1,A Pot of UN Money. Risk-Taking Officials. A Sea of Questions. https://ift.tt/nca4iPG,1
1,Russian troops separate mother and child evacuated from Azovstal https://ift.tt/FUpjEhr,1
1,Most of Beijing to be tested for COVID amid lockdown worry https://ift.tt/DjZQ0eJ,1
1,Mexico&#39;s President Andres Manuel Lopez Obrador called Sunday for an end to US sanctions against Cuba as he concluded a migration-themed tour of Central America and the Caribbean. The trip has also,1
1,"Colombia&#39;s Chocó, abandoned and engulfed by violence https://ift.tt/vAnWNRr",1
1,US diplomats return to Kyiv embassy on first visit since invasion https://ift.tt/41VHonG,1
1,"Russia says it won&#39;t use nuclear weapons in Ukraine, despite threatening rhetoric https://ift.tt/3OsyzQJ",1
1,Shanghai tightens its already strict COVID-19 lockdown to hit zero-COVID target by end of May https://ift.tt/QhsvJ1A,1
1,Russia said to pull troops from Syria to bolster forces in Ukraine https://ift.tt/ThnyVD7,1
1,"G7 to phase out Russian oil, US sanctions Gazprombank execs over Ukraine war https://ift.tt/YfFEIzV",1
1,US commission accuses Switzerland of hiding Russian assets https://ift.tt/2RTOzG3,1
1,G7 leaders pledge to ban or phase out Russian oil imports https://ift.tt/DjZcb1S,1
1,India wants Russia to discount its oil to less than $70 a barrel https://ift.tt/98mWXJq,1
1,Three dozen tycoons met Putin on invasion day. Most had moved money abroad. https://ift.tt/m4n1pMN,1
1,Russian kindergarten children dress up as tanks adorned with a &#39;Z&#39; for Victory Day event https://ift.tt/CReFjYT,1
1,"Jill Biden crosses into Ukraine, meets first lady https://ift.tt/8rC316D",1
1,U2&#39;s Bono gives &#39;freedom&#39; concert in Kyiv metro https://ift.tt/N3K0aCs,1
