Category,Message,real
0,"What video games can I play with my father? I am 17M and my father is 45, I am wondering what games would be good to play together. I ask because most of the games I play aren&#39;t his style, He isn",0
0,"Australian Lads My uncle is in the US right now. What is something that I couldn&#39;t get in Australia but could get there? If you&#39;re not Australian, any gaming related recommendations anyway?",0
0,"What&#39;s with all the smash bros clones? So a few years ago battle royale was the big thing and every game did it, they still do well but there&#39;s been a tone of new brawl style games, there was",0
0,Best exercises to do whilst gaming? Was thinking something like 10 push ups and sit ups everytime I die on elden ring. Anyone else have any great ideas? Open to suggestions.,0
0,"sometimes I wonder if I&#39;m really 22, or if it&#39;s just a simulation. https://ift.tt/68mXbxe",0
0,any idea who this could be? https://ift.tt/hiCv8Sr,0
0,Do you reccomend Cyberpunk 2077 or God of War and why? I want to buy one of these games but don&#39;t really know which one I should buy. I heard something about frame drop in cyberpunk on ps4 pro so,0
0,Awesome portal fanart!(credit:u/lastlovetatoo) https://ift.tt/uxWwkXJ,0
0,What game is taking forever to release (or hasn&#39;t been announced) which you wish you could play in your lifetime? I&#39;d really love it if I was alive when these games come out: GTA6 FF7 remake (,0
0,Uncharted 2 vs Gears of War 3 Which game do you like better and which one you think is a better shooter?,0
0,What year is it? https://ift.tt/o2SJgx1,0
0,"Why do people hate SBMM? The way I see it is, that you should be matched with players of ≈equal skill level with a little bit of better and worse players. I&#39;ve heard people say they enjoyed having",0
0,Help im having a dilemma which should i buy? PS5 or Nintendo Switch? Dont you dare say both,0
0,my 4yo solo playing 2 player mode to get the extra lives on Super Mario... proud parenting moment https://ift.tt/QAy9qUp,0
0,"The CIA files released after the 2011 raid showed the al Qaeda leader had downloads of popular games like Half-Life, Super Mario Bros, Yoshi&#39;s Island DS, Final Fantasy VII, Dragon Ball Z, &amp;",0
0,every single time https://ift.tt/an7siVP,0
0,"Advice or suggestions, if you have either. PC player, first things first. Just beat Elden Ring for the 2nd time, being a fan of the FromSoft games for a long time. Over 280 hours on Valheim and such.",0
0,About a game elder scrolls 5 skyrim So I have heard Skyrim was a big deal and now a days elden rings ....I wanna know opinion about the game cause i have neither played any of that. When i saw elden,0
0,"Walking from EB to the parking lot carrying this and driving home with it was the scariest shit I&#39;ve ever done, but it was worth it. https://ift.tt/mJ4tA1c",0
0,(SFM) hideout Planning https://ift.tt/mKTuGfM,0
0,Is Dead Space as scary as Resident Evil 2? I don&#39;t play scary games. Alien Isolation and Resident Evil 7 were the scariest i&#39;ve played and couldn&#39;t finish because of it. Resident Evil 2,0
0,"Nintendo Wii Shopping Channel music on acoustic guitar, with tab and score https://www.youtube.com/watch?v=Y6Kj_aToNpI",0
0,Relaxing Souls Game https://ift.tt/95XWg8d,0
0,Where did time go? https://ift.tt/4K6jx2c,0
0,Just found this cute Easter egg in Horizon Forbidden West! https://ift.tt/UIlNYXr,0
0,"Spooky Game 2032, a casual co-op horror game that I&#39;ve been working on as a hobby. I&#39;d like to get some initial feedback on an alpha trailer. Thanks! https://www.youtube.com/watch?v=chg1WOc4a1k",0
0,Waiting for the new Stanley Parable Ultra Deluxe to finally come out be like - https://www.youtube.com/watch?v=4i2BfnDVZac,0
0,Who else misses instruction booklets? https://ift.tt/FtE2LGf,0
0,What games are good co op games that me and my buddy could just hop on and it is always fun? No text found,0
0,When your game is difficult but that&#39;s not its whole identity you can do this https://ift.tt/9gyfUht,0
0,Just downloaded Mass Effect Legendary Edition. Is it good? Any tips? No text found,0
0,What gaming device and which of its games gave you the best memory? No text found,0
0,"I just like it, okay? https://ift.tt/nsWc0p9",0
0,This 40y/o handbook sort of predicted VR gaming https://ift.tt/SD6rolJ,0
0,"Got a GBA Emulator, and Finally Beat Mario &amp; Luigi Superstar Saga 19 Years Later https://ift.tt/NnVL89k",0
0,anyone rekon he played cod or CS:GO? https://ift.tt/XxhEuvt,0
0,"Do I buy too many games? Assuming a flat $60 price, how much have you spent on games? Mine&#39;s $24480. https://ift.tt/3qPVhsu",0
0,Metroid prime 2 drawing https://ift.tt/VFBh8Ko,0
0,"In a game, are graphics or performance more important? No text found",0
0,My idea for a new Portal game When Aperture discovered that Moon rocks make great portal textures they decided to expedite the moon for materials and subsequently test in zero gravity. However for,0
0,I enjoyed Duke Nukem Forever. The game is stupid and ugly with graphics but that was the charm in it that I liked. It felt like a comedy game and I thought it had a lot of creativity as well.,0
0,whats your fav story mode game of 2022 so far? No text found,0
0,He likes to join me while I game 🤓 https://ift.tt/ox2NS8X,0
0,"Fantastic Easter Egg in Cyberpunk 2077!! Next to River&#39;s family mobile home, there&#39;s train tracks with these two bodies you can loot GREEN items from lol https://ift.tt/qeXGmP4",0
0,is Dune: Spice Wars a remake of Dune 2/Dune 2000? I just noticed an early access of Dune: Spice Wars on Steam. I remember playing Dune 2 when it first came out and Dune 2000 (obviously made with the,0
0,umm.... sure https://ift.tt/gUjVxTE,0
0,you know you&#39;re In a GTA session when Say in comments,0
0,UNO certainly makes me want to commit a crime https://ift.tt/iEvk4AQ,0
0,What yakuza game should I play? so I just bought yakuza 3 for 4 dollars what other yakuza games should I try out I&#39;m playing it on console btw.,0
0,"Is Crossout any good, I&#39;m on PS4, and have been looking at this free game called Crossout for a while, it looks pretty cool, but not sure if ita any good. Anyone else play this game? What&#39;s",0
0,"Looking to upgrade from my Wiimote Not a joke TLDR; what is the best controller for use with a PC? Ideally something budget Background: I got a new laptop with Win11, I am running into all sorts of",0
0,"Is it just me? I&#39;m having trouble getting into Horizon Forbidden West? Does it take some time to get invested? I&#39;m playing on the ps4, maybe it&#39;s the 30 fps that I&#39;m not enjoying",0
0,"Do you use motion steering in Mario Kart 8, and if so, why? I honestly haven&#39;t even given it a chance since the Wii, so for all I know it could be good now. I really don&#39;t know. I could see it",0
0,"Other than Wii Sports/Resort, what game made good use of motion controls? Was there a game you enjoyed playing with motion controls that really added to the game, rather than just being a &quot;fun",0
0,Best live service game i&#39;ve played https://ift.tt/2jXUzvb,0
0,"The phone one is okay, too, but it&#39;s not the OG https://ift.tt/dUJVZFy",0
0,deadliest warrior https://www.youtube.com/watch?v=rDconhOe7hQ&amp;ab_channel=WorldBoxSimulations,0
0,What are you playing Wednesday! What game&#39;s got your attention this week? What&#39;s great about it? What sucks? Tell us all about it! ​ This thread is posted weekly on Wednesdays (adjustments made,0
0,What&#39;d be your Arcana in the Persona universe? https://ift.tt/zcUnjPg,0
0,Currently playing Chernobylite and testing the new Series X update. I&#39;m dying right now at this attempt of the main character locking out enemies 🤣 https://ift.tt/joSQ8ac,0
0,You okay? https://ift.tt/SpZgaMt,0
0,"Which game did you guys think was harder? Elden Ring or Dark Souls III? I came to this sub for a potentially unbiased opinion, r/darksouls3 would probably say their game, and r/eldenring the same...",0
0,"I&#39;ve been living under a rock, and I have literally no idea what Elden Ring is all about. What&#39;s the appeal to it? No text found",0
0,Make assumptions on me by my taskbar. ​ https://preview.redd.it/q205jjppxxv81.png?width=1366&amp;format=png&amp;auto=webp&amp;s=6d0e90e821d8d9ac9f11abd591043f9ff777ca94,0
0,Looks like a grandpa and his Zoomer grandson (pulled out my ps2 for the first time in a few years) https://ift.tt/aexIS4M,0
0,Beast Fists Gameplay I Fighting game 2022 https://www.youtube.com/watch?v=IcDsY5EXp3w&amp;feature=youtu.be,0
0,I know nintendo would never do it. But legend of zelda with souls like combat has the potential to be the greatest game ever. Granted they add the combat and still keep the puzzle dungeons.,0
0,&quot;Small bugs&quot; and &quot;A lot of hype for nothing that great&quot; ​ https://preview.redd.it/emc2a0c6zxv81.png?width=753&amp;format=png&amp;auto=webp&amp;s=,0
0,ULTIMATE YARD GAME TOURNAMENT system design and development. Hi. For several years now I have been developing a yard game tournament for summer house parties. Beer-olympics as some people call it. All,0
0,Warhammer 3 Red Ulgor Prince of Slaughter Low Vs Ultra Graphics Quality https://youtube.com/watch?v=okYYz_fLhGA&amp;feature=share,0
0,Is the Contra series the hardest videogame series of all time in classical videogames? No text found,0
0,Why do reviewers declare every new Zelda game as the best in the franchise ? I was watching some old IGN reviews and noticed they always declare every new Zelda game to best in the franchise. They did,0
0,CODs a joke https://ift.tt/43Fkt8O,0
0,Upcoming Horror Games to look forward to in 2022: https://ift.tt/nMIXCkm,0
0,SoulsVania https://ift.tt/2PlJDb7,0
0,Invincible! https://ift.tt/N4IafWl,0
0,GTA Online just look at the night sky and the full moon this game indeed is beautiful https://ift.tt/ioXTMYV,0
0,Standing here I realize https://ift.tt/ihM1mtI,0
0,"One of my favourite Special Editions, Halo Xbox Series X, with a special symbols that gets revealed by UV Light. https://ift.tt/FnC4QA1",0
0,"Are side quests necessary I don&#39;t hate them, but if they weren&#39;t there and the focus was put on making the main story longer/better would that be a bad thing. Also I hate when you progress a",0
0,"If you were going to make a trivia round about video games, what&#39;s a question you would ask? I&#39;m going to a trivia session tonight and I like to think I know a lot about video games but I am",0
0,Ubisoft says some games listed as taken offline were errors https://ift.tt/D5jYivq,0
0,"&quot;Virtual Reality Can&#39;t Come Soon Enough&quot; from 2015. It&#39;s dated, a little sad and creepy, but with somewhat charming animation and character design. https://ift.tt/7ESi3hc",0
0,"What are some games that are a knock off of the original, but they ended up becoming more popular/iconic than the original? No text found",0
0,Video Game Music for Sleep playlist https://ift.tt/ENvXyH4,0
0,Time for another rework https://ift.tt/LqxZdJc,0
0,Call of Duty has lost 50 million players in a year https://ift.tt/MmgSYL1,0
0,"If these Rockstar Games Protagonists are in a Battle Royale, who would be the winner? https://ift.tt/L8lntRM",0
0,What do yall think? Dr strange got added https://youtu.be/aCrNTCk8hGs,0
0,Just got Duke Nukem 3D and I couldn&#39;t be happier. https://ift.tt/5C9lVIX,0
0,"The more I play, the more I feel it&#39;s less about the grind and more about the laughs https://youtu.be/muv04JGsfAU",0
0,true gamer moment right here https://ift.tt/F671EpZ,0
0,"What are the best video games to be played with “strip” rules? Let&#39;s be real, it&#39;s 2022 and strip poker is too obvious and boring. What video games can be played to have the best “strip” rules?",0
0,Play titanfall on may 1st for Titanfall day https://ift.tt/b7Ho56Q,0
0,who Is this and from what is she from? https://ift.tt/s2ygaA6,0
0,"Does my game library transfer from Xbox One to Series X? My Xbox One broke and I&#39;m thinking of just upgrading, rather then rebuying a One, if I still have all my log in info for my gamertag, will",0
0,"can anyone identify the game in the video, (I used we transfer because the sub doesn&#39;t let me post video files) https://we.tl/t-AzlgM7QbFs",0
0,"Fan art of one of my favorite games, drawn by me https://ift.tt/r2zZQSB",0
0,"Hey guys. Been doing a bunch of personal concept art just to bring myself back into the flow to start working on projects again. Critique it, compliment it, anything is welcome. https://ift.tt/mu81PnA",0
0,"Any good spaceship building games? I mean like good sci-fi games where it&#39;s not just customizing a ship, but like actually building it from scratch. But not super complex or anything, and I can fly",0
1,Taiwan set to send more soldiers to US for military training https://ift.tt/qJAX3o1,1
1,Unexplained acute hepatitis cases in children near 200 worldwide as authorities investigate cause https://ift.tt/n4bBdCP,1
1,EU says Russian gas halt is attempt to use fuel as blackmail https://ift.tt/6OfVkDA,1
1,Minister says China timed Solomon Islands security deal to damage Coalition&#39;s election chances https://ift.tt/RbHer6F,1
1,Taiwan protests Solomon Islands&#39; security pact with China https://ift.tt/STpGm5R,1
1,Moldovan breakaway region says shots fired from Ukraine towards village https://ift.tt/f69oGrZ,1
1,Tesla&#39;s Stock Plunged $126 Billion After Elon Musk&#39;s Twitter Deal https://ift.tt/Uh5zTNt,1
1,Russia accused of blackmail after gas supplies to Poland and Bulgaria halted https://ift.tt/5Sxw9ov,1
1,"Mysterious Explosions Throughout Russia, Belgorod Ammunition Depot on Fire https://ift.tt/Cb3ep1k",1
1,Australian minor parties condemn &#39;discriminatory&#39; ban on dual citizens in parliament https://ift.tt/TaiG2PD,1
1,"Syria says 4 soldiers killed, 3 hurt in Israeli strike near Damascus https://ift.tt/7ey8sUc",1
1,Russia accused of &#39;blackmail&#39; after halting gas supplies to two European countries https://ift.tt/wXf20Nv,1
1,Palestinian killed in gunfight with Israeli troops in Jenin https://ift.tt/gmj1EYS,1
1,"Russia is &#39;bullying&#39; Poland and Bulgaria by cutting off their gas supply, UK minister says https://ift.tt/pOgHzTm",1
1,"Education minister unveils matriculation reform, riling teachers https://ift.tt/zDksGJB",1
1,"Russia halts gas supplies to Poland, Bulgaria https://ift.tt/RQXaSie",1
1,Gazprombank vice-president flees from Russia to join Ukraine&#39;s territorial defense forces https://ift.tt/hcUgnxJ,1
1,"West should provide warplanes, says Liz Truss, UK Govt minister https://ift.tt/uvQAlLp",1
1,Massacre in Tadamon: how two academics hunted down a Syrian war criminal https://ift.tt/AXdOyHq,1
1,Taiwan says Ukraine conflict will inform this year&#39;s military drills https://ift.tt/Yl1UtA6,1
1,Outcry as Singapore executes man with learning difficulties over drugs offence https://ift.tt/CJ4Ogb7,1
1,China angered as US sends destroyer through Taiwan Strait https://ift.tt/AWtIhE7,1
1,The Government Has Run Out Of Ideas On How To Tackle The Cost Of Living Crisis https://ift.tt/BtxmVc6,1
1,Ukraine marks 36 years since the Chornobyl nuclear disaster https://ift.tt/yqSeaZN,1
1,Germany is sending 50 tanks to Ukraine to fight Russia and will train Ukrainian troops on German soil https://ift.tt/JUmHdLz,1
1,"Saudi Arabia, France launch humanitarian projects in Lebanon | Poverty and Development News https://ift.tt/5DanX31",1
1,Scores flee for their lives ahead of Russia&#39;s sham independence vote in Kherson https://ift.tt/fKWMmvF,1
1,Mali accuses France of &#39;spying&#39; after mass graves video emerges https://ift.tt/V8FZz9m,1
1,France&#39;s Schneider Electric to sell Russian assets to local management https://ift.tt/niuOVwI,1
1,"Russia cuts gas to Poland, Bulgaria, West vows arms for Kyiv | AP News https://ift.tt/EpIO0j9",1
1,Russia&#39;s Gazprom halts gas supplies to Poland and Bulgaria https://ift.tt/qLO4x8r,1
1,Austria agrees to pay for Russian gas in rubles https://ift.tt/RfouEs8,1
1,China is paying reputational cost for sitting on fence on Russia&#39;s invasion of Ukraine: Tony Blinken https://ift.tt/ApvUDjB,1
1,SpaceX Falcon 9 with Dragon Capsule Freedom Launched to INTERNATIONAL Space Station (so International news). https://ift.tt/UgfHeKo,1
1,"In embarrassing reversal, Germany&#39;s freshman chancellor agrees to supply tanks to Ukraine https://ift.tt/18uX4Lj",1
1,40% Of Global Real-time Payments Originated In India In 2021: Report https://ift.tt/mLBYXSj,1
1,US Armed Forces forbid soldiers from visiting Israel https://ift.tt/BDKplzf,1
1,Forbes India - India&#39;s Russian Oil Purchases Double 2021 Total Since Ukraine Invasion https://ift.tt/61YumQH,1
1,France&#39;s Atos moves Russian services to India and Turkey amid Ukraine war https://ift.tt/R5lUm6I,1
1,Myanmar&#39;s Suu Kyi handed 5 year jail term for corruption. https://ift.tt/eWvGriU,1
1,"India-Europe will be on same page over Ukraine crisis, says Polish minister https://ift.tt/wYtBxh0",1
1,India struggles to find vessel to ship crude from Russia https://ift.tt/G34ESRX,1
1,singapore: Singapore executes disabled Malaysian convicted in drug case despite international condemnation https://ift.tt/WFAOi64,1
1,"Greenpeace calls out UK government for continuing to import Russian oil - A total of eight tankers have delivered shipments of Russian oil to the UK since February 24, averaging one every week,",1
1,"Russia cuts gas supply to Poland,Bulgaria. https://ift.tt/2vlM36t",1
1,"Be wary of foreign interference, China warns Central Asia https://ift.tt/ry4wgvS",1
1,Outcry as Singapore executes man with learning difficulties over drugs offence https://ift.tt/CJ4Ogb7,1
1,Philippines pulls Hollywood action flick from cinemas over South China Sea map https://ift.tt/Up4LCQD,1
1,New Zealand High Court finds quarantine allocation system infringed on rights https://ift.tt/YrosN7a,1
1,Russia could target UK diplomats in Kyiv once they return to the city https://ift.tt/OdEAWqY,1
1,Russia suspends natural gas supplies to Poland and Bulgaria https://ift.tt/Tequ4Ft,1
1,Tesla shares sink amid concerns about Elon Musk&#39;s proposed takeover of Twitter https://ift.tt/BCE4TIc,1
1,Ukraine&#39;s state-owned Naftogaz warns that disruption to operations at Ukrainian compressor stations in areas occupied by Moscow could lead to the loss of one third of Russian gas transit volumes to,1
1,Japan&#39;s ruling LDP proposes doubling of defense budget https://ift.tt/euTkLWn,1
1,"Serious risk of a nuclear war real; Nato using proxy, says Russia https://ift.tt/bv6NFdV",1
1,S. Korea&#39;s childbirths hit another record low in Feb. https://ift.tt/Bs71GTp,1
1,"UN adopts veto draft, India regrets lack of inclusivity | India News - Times of India https://ift.tt/hml8esB",1
1,India and the Netherlands are on the same page on invasion of Ukraine: Dutch minister https://ift.tt/7I53NjS,1
1,Senior Gazprombank Executive Flees Russia to Join Ukraine War https://ift.tt/hcUgnxJ,1
1,"China&#39;s DJI halts Russia, Ukraine sales to prevent use of its drones in combat https://ift.tt/wtHM7oh",1
1,"Germany &#39;very, very&#39; close to independence from Russian oil https://ift.tt/Z5lhQac",1
1,Myanmar court sentences Suu Kyi to 5 years for corruption https://ift.tt/REw3LGQ,1
1,Russian gas supplies resume to Poland - operator data https://ift.tt/i08XFNb,1
1,Britain says Ukraine controls majority of its airspace https://ift.tt/d14Dcm2,1
1,"Russia Has Fired 1300 Missiles in Ukraine This War, More Strikes Expected https://ift.tt/sMBtI2D",1
1,Singapore executes disabled Malaysian convicted in drug case https://ift.tt/I0NPYja,1
1,Vietnam eyes doubling of power generation capacity by 2030 https://ift.tt/x9qTvts,1
1,The United States marshaled 40 allies on Tuesday to furnish Ukraine with long-term military aid in what could become a protracted battle against the Russian invasion https://ift.tt/2MU30eo,1
1,Poland says it will manage without Russian gas https://ift.tt/EnJtrq9,1
1,White House worried Iran &#39;weeks away&#39; from developing nuclear weapons https://ift.tt/Ypb6LcD,1
1,Germany agrees to send heavy weapons to Ukraine after major policy U-turn https://ift.tt/f0WjwI6,1
1,"Russia will shut off gas supplies to Poland, state-run company says | CNN Business https://ift.tt/GtuWQs0",1
1,Putin&#39;s Red Line for Ukraine Puts Peace Deal at Risk https://ift.tt/gIziyds,1
1,Chinese navy ship enters Japan waters near Kagoshima Pref. islands https://ift.tt/dirGjy7,1
1,Telford naturists get their kit off for Ukraine on run through the woods https://ift.tt/PtWTG6V,1
1,Self-driving vehicle will take to the roads for trial on famous Forth bridge https://ift.tt/EImXJNM,1
1,Canada Wants to Use Seized Russian Assets to Pay Ukraine Victims https://ift.tt/1L6y7NH,1
1,"Croatian President threatens to block Finland, Sweden joining Nato unless Bosnian electoral law is reformed https://ift.tt/5J6m81A",1
1,US looks to assist war crimes prosecutions targeting Russian leaders https://ift.tt/PrU97vo,1
1,Russia is suspending natural gas supplies to Poland and Bulgaria : NPR https://ift.tt/fvceLXn,1
1,The war in Ukraine is driving hunger in Lebanon https://ift.tt/A9H4i6p,1
1,Zelenskyy says Russia-Ukraine peace talks will end if Moscow holds &#39;pseudo-referendums&#39; in occupied areas or moves to grab more Ukrainian territories https://ift.tt/QSDR21P,1
1,Pilot&#39;s cockpit cigarette sparked fire that brought down jet and killed 66 - Investigation finds crash of EgyptAir flight MS804 was caused by cigarette in the cockpit that ignited oxygen leaking,1
1,Twitter CEO set to receive $42 million if terminated after Musk deal https://ift.tt/2vWmnlN,1
1,Russia accuses UK of provoking attacks on its territory https://ift.tt/Lr1eYXj,1
1,Temperatures to top 110 in New Delhi as searing heat wave bakes India https://ift.tt/uzGHkgX,1
1,China reports first human case of H3N8 bird flu https://ift.tt/k2A7nh8,1
1,US intel helped Ukraine shoot down Russian plane carrying troops and more https://ift.tt/LQaYIoh,1
1,VIDEO: Ukraine destroys 4 Russian armored vehicles in a row with missiles https://ift.tt/qfdNh7r,1
1,Women are lagging behind men in Web3 investing https://ift.tt/zjJZG5p,1
1,Germany is sending 50 tanks to Ukraine to fight Russia and will train Ukrainian troops on German soil https://ift.tt/mXRshDQ,1
1,Putin Said in 2018 Russia Would Use Nuclear Weapons If Attacked https://ift.tt/zoE0hjX,1
1,Russia claims Ukraine &#39;saturated&#39; with weapons of mass destruction https://ift.tt/Rg3GhyH,1
1,"Nato isn&#39;t ready for war with Russia, warns UK general https://ift.tt/ZQGfVsj",1
1,Elon Musk blasts Twitter staff threatening to sabotage tech giant https://ift.tt/uZyLlke,1
1,Turkish businessman and philanthropist Osman Kavala sentenced to life over Gezi Park protests https://ift.tt/hjJq57X,1
1,Russia to suspend natural gas supplies to Poland and Bulgaria over roubles https://ift.tt/8BhILyj,1
1,Mariupol City Council shares scary photos of Azovstal hospital: Immediate evacuation needed https://ift.tt/OaZ1Lvd,1
1,"Russia suspending gas supplies to Poland, Bulgaria https://ift.tt/vz45V18",1
1,"More than 8 million people will flee Ukraine as refugees, UN predicts : NPR https://ift.tt/eNCptom",1
1,Iran has not received £400m agreed by UK at time of Zaghari-Ratcliffe release https://ift.tt/1WelMrJ,1
1,"US has been trying to push back unilateral actions, particularly by Azerbaijan, that would inflame the situation – Blinken – Public Radio of Armenia https://ift.tt/tbz5MZF",1
1,Austria says Russian gas still flowing as it scrambles for alternatives https://ift.tt/zg9y5oI,1
1,Explosions as Ukraine Drone Spotted 140 Miles Into Russia&#39;s Territory https://ift.tt/MD4Xv8A,1
1,France and Germany &#39;sold £230000000 of weapons to Russia before invasion&#39; https://ift.tt/raWyNh6,1
1,Zelenskyy suggests Russia is trying to target more of Europe after explosions in separatist region of Moldova https://ift.tt/GmVlzkW,1
1,Ukraine war: Russia halts gas exports to Poland and Bulgaria https://ift.tt/EnJtrq9,1
1,Russia shuts off gas supplies to Poland and Bulgaria https://ift.tt/pJCPDOG,1
1,"Russia says it hit US, European weapons in missile strike in Ukraine https://ift.tt/mO8Na4M",1
1,Behind &#39;Advance Australia&#39;: the lobby group causing a stir with its ads https://ift.tt/Fi8KrqP,1
1,"Facebook Doesn&#39;t Know What It Does With Your Data, Or Where It Goes: Leaked Document https://ift.tt/yJPRSTp",1
1,Heat wave in India threatens residents and crucial wheat harvest https://ift.tt/4vHmnCq,1
1,Russian forces pummel Ukrainian fighters holed up in Mariupol steel plant - mayoral aide https://ift.tt/kzt6TjX,1
1,Aung San Suu Kyi: Former Myanmar leader sentenced to five years in prison for corruption https://ift.tt/a1inFoQ,1
1,Russian-backed Transnistria claims attack launched from Ukraine near ammunition depot https://ift.tt/rGgPdMb,1
1,"PFAS &#39;Forever Chemicals&#39; Might Be Hurting Our Livers, Study Finds https://ift.tt/1Xvp8NR",1
1,Say Goodbye to Incandescent Light Bulbs https://ift.tt/MlSkztP,1
1,Poland and Bulgaria say they won&#39;t bow down to Russia after Gazprom shut off their gas supply https://ift.tt/FnykLNQ,1
1,Hackers Sexually Extort Kids With Stolen Data: Report https://ift.tt/c3JgHqR,1
0,"Crysis doesn&#39;t hold up in 2022, even compared to other games from 2007 Played the Remaster on PC for the first time, after years of hearing about it as the be-all end-all of FPS. And honestly I don",0
0,Has anyone here managed to get in shape as a result of using fitness games such as Ringfit Adventure? No text found,0
0,what are the best games to play with friends at the moment So I&#39;ve played a lot of games when I was younger but it has gone forgotten lately. Now I want to start playing games again but I don&#39;t,0
