Category,Message,real
1,Raw sewage &#39;pumped into English bathing waters 25000 times in 2021&#39; https://ift.tt/VjuI9P3,1
1,Russian spy detected in Ukrainian military staff https://ift.tt/vFMWzp0,1
1,"India, EU to hold talks on FTA in June, set 2023-2024 target [The Indian Express] https://ift.tt/DE2AuFJ",1
1,Israel to summon Russian ambassador over FM&#39;s Nazi comments https://ift.tt/YSQ4GBy,1
1,Russian military aircraft violated Swedish airspace during NATO visit https://ift.tt/bnFyDsG,1
1,&#39;No choice&#39;: Shanghai residents sent out of city during COVID-19 crackdown https://ift.tt/KFQt79D,1
1,Russian Tycoon Criticized Putin&#39;s War. Retribution Was Swift. https://ift.tt/VbpHser,1
1,Chinese radar &#39;is watching missile threats from Korean peninsula and Japan&#39; https://ift.tt/GboJVyX,1
1,Ukraine Says Russia Looted Ancient Gold Artifacts from Museum https://ift.tt/vDnaMkh,1
1,"As allies visit Ukraine&#39;s capital, Canada&#39;s absence is being noticed | CBC News https://ift.tt/p1C6XI0",1
1,EU energy ministers hold crisis talks after Russian gas cuts https://ift.tt/fA1OPF7,1
1,Russia Not Seeking to End Ukraine War by May 9 – Foreign Minister https://ift.tt/P6mbhYJ,1
1,Ukraine says Russia stole &#39;several hundred thousand tonnes&#39; of grain https://ift.tt/tsImrNd,1
1,Ukraine war: Families hide in cellars as Russia targets Donbas region https://ift.tt/ixwLCOd,1
1,Russia claims it destroyed US weapons in Ukraine airfield attack https://ift.tt/jHC4gIT,1
1,No one can be forced to get vaccinated - Indian Supreme Court https://ift.tt/bWKU07V,1
1,Mariupol evacuee recounts terror in bunkers below Azovstal steelworks | Ukraine https://ift.tt/xAtXLRz,1
1,Japan energy giant Eneos to exit natural gas project in Myanmar https://ift.tt/XkMhRlu,1
1,Ukraine: Russian Forces Fired On Civilian Vehicles https://ift.tt/GkVe5vb,1
1,Foreign minister says Taiwan prepared to defend itself in conflict with China https://ift.tt/ECKTi7Q,1
0,These Sims 4 expansion packs are getting out of hand. https://ift.tt/xw6NHBG,0
0,"Tomb Raider, Deus Ex, and Legacy of Kain Franchises Sold by Square Enix https://ift.tt/7LzbKwg",0
0,This is why I should have sticked with the digital version. I can&#39;t believe I couldn&#39;t figure out how to open the box. I though the plastic that holds the label was part of the shrink wrap,0
0,Fireteam ? K24 D6 could use a squad with similar stats 🌿👀🌿 https://ift.tt/2k1naOx,0
1,Angelina Jolie visits children evacuated from Luhansk region https://ift.tt/Z8VLFH6,1
1,"Amid broken ties and families, Crimean views toward Russia start to shift https://ift.tt/K7sAltN",1
1,No fireworks for Israeli Independence Day celebrations over PTSD concerns https://ift.tt/Qm0Dp5b,1
1,Finland has walked a political tightrope between Moscow and the West for decades. But that could be about to end https://ift.tt/druExcM,1
1,"Lavrov: So what if Zelensky is Jewish, even ... https://ift.tt/rEiGXWk",1
1,Ukrainians face serious fuel shortage https://ift.tt/5DyhAmd,1
1,Cubans take to streets on Worker&#39;s Day for first time in three years https://ift.tt/4swkAQu,1
0,Rumor: Sony and Microsoft Among Companies Interested in Purchasing Warner Bros. Studios Rumor has it that Sony is eyeing Warner Bros. Discovery&#39;s development studios for future PlayStation,0
1,"Another former sex slave dies, reducing number of surviving victims to 11 https://ift.tt/UZFcCpm",1
1,Taiwan considers alternatives after US informs of howitzer delay https://ift.tt/86NBXJ9,1
1,"Philippines fire kills eight, including children https://ift.tt/1nHqLKS",1
1,IAEA sees limited impact of water release at Fukushima nuclear plant https://ift.tt/auzXVrM,1
1,Israel outrage at Sergei Lavrov&#39;s claim that Hitler was part Jewish https://ift.tt/BF2WyHe,1
1,Dispatch from Ukraine: Here&#39;s what CNN is seeing on the ground in Lviv https://ift.tt/8LrQGEu,1
1,Pakistani Airstrikes Escalate Conflict on Afghan Border https://ift.tt/LwCz36Z,1
1,Israel outrage at Sergei Lavrov&amp;#x27;s claim that Hitler was part Jewish https://ift.tt/BF2WyHe,1
1,"India, Russia in talks over 20 million barrels of crude at discount https://ift.tt/hXTPN7q",1
1,"Ukraine war: Indian exporters head to Russia, eye food, chemicals | India Business News https://ift.tt/cgPC4ZY",1
1,Russia moves to consolidate its modest gains in Ukraine ahead of symbolic May 9 deadline https://ift.tt/y1be7Rx,1
1,India Asks State Oil Majors To Buy Sanction-Hit Russia Assets: Report https://ift.tt/jDZSr5I,1
1,"As Iran-Taliban tensions rise, Afghan migrants in tinderbox https://ift.tt/FdjlNkB",1
1,"Ukraine Says Drone Destroyed 2 Russian Ships in Black Sea, Releases Video https://ift.tt/Xch5Big",1
1,"Brit prisoners in Russia may face death penalty over claims of &#39;crimes on civilians&#39; Aiden Aslin, 28, and Shaun Pinner, 48, were both captured within days of each other while fighting alongside",1
1,Ukraine war: Hundreds trapped in Mariupol steelworks despite evacuations https://ift.tt/LQ9sCRh,1
1,1202 bodies of civilians killed by Russian troops already found in Kyiv region https://ift.tt/buDGxSd,1
1,India&#39;s jobless rate rises to 7.83% in April - CMIE https://ift.tt/FRWOwJL,1
0,Should I get Dying Light 2 or Elden Ring? I have played the first Dying Light and I had a lot of fun but I&#39;ve also never played a game like Elden Ring and am trying to broaden my gaming pool. It,0
0,"Is metal gear solid v worth it? I wanted to buy this game for a long time, but I want to know what people think after they played it. (I apologize if this is not where I should ask)",0
0,Just cleaned. Felt cute. Might delete later. https://ift.tt/0kEd6ra,0
0,Terra Maledicta - Call of Duty Vanguard Zombie | UHD https://youtu.be/kAvSra_BH8k,0
0,Is there anyone who doesn&#39;t link their social media accounts to their gaming profiles? No text found,0
0,"Which PC for gaming? Hey guys, I hope this is the right place to ask. I want to buy a PC for gaming and doing uni stuff. I don&#39;t have so much money and I don&#39;t have any clue what is good and",0
0,"Square Enix Sells Crystal Dynamics, Eidos-Montréal including Tomb Raider, Thief, Deus Ex IPs to Embracer Group https://ift.tt/tID410k",0
0,"Video Games Should Change The Way Post-Game Is Handled I realise that this may be an unpopular opinion and I am prepared for the disagreements, also to add it&#39;s very rare that I come across",0
0,"As someone that loves the Horizon series, this made me love it even more! Eid Mubarak! https://ift.tt/aFgC9k3",0
0,redit donde puedo encontrar binarios para mandar por wsp? No text found,0
0,I only want to touch Lara crofts tities before dying to Mario https://ift.tt/8wEZGBr,0
0,Uncut Manhunt 2 kills. Imagine a 3rd entry with RDR2 graphics. https://youtu.be/Q-yXJVOhgHQ,0
0,"Todays Free Aim Upload! Please go give it a look, maybe even like and subscribe if you really feel like 😁👊💪🔥🤠😼 https://youtu.be/HhOHY3onzNI",0
0,Trying to remember a game So over a few beers last night we started to remember a game which we absolutely could not place. All we remember is 4 British / Australian squirrels in space suits (one was,0
0,best main menu song in a game? My vote&#39;s for Quake. Trent Reznor did an Amazing job with the OST for Quake.,0
0,"Square Enix Selling Tomb Raider, Deus Ex &amp; Thief (And Their Studios As Well) https://ift.tt/jz7X62r",0
0,Panzer Front is the best tank sim game sadly no one remembers https://youtu.be/GKebk01bUrA?t=821,0
0,"Elden Ring Not Opening Hi Y&#39;all, I just got Elden Ring and for whatever reason it&#39;s just not working. I have a 2070 and it only uses up about a quarter of my ram at any given time and I just",0
0,I love Death Stranding on PS4. I can&#39;t wait to see the enhancements at 60FPS! https://ift.tt/rMkmqF3,0
0,"Help to find this game&#39;s name please There was a game which I played on mobile a few years ago, where we needed to fight giant monsters like dragons and other monster, I remember one of them being",0
0,What game or video game soundtrack floods your mind with nostalgia when you think about it? No text found,0
0,Best 3-5 player online games that isn&#39;t a card game. No text found,0
1,India&#39;s neutrality on Ukraine tops agenda as Modi heads to Europe https://ift.tt/3ZSak7Y,1
1,Chemical giant IMCD stops its business in Russia https://ift.tt/D6SK2Ie,1
1,Russian TV warns Britain will be &#39;drowned in radioactive tsunami&#39; missile strike https://ift.tt/ge4PirQ,1
1,Russia resumed shelling of steel works after evacuation buses left - mayor&#39;s aide https://ift.tt/TaYnyL5,1
1,Putin shamed as brutal Chechen warriors execute Russian troops in Ukraine https://ift.tt/AwFs9z1,1
1,British Virgin Islands premier accused of smuggling cocaine https://ift.tt/PDBkiFn,1
1,Elon Musk&#39;s China problem https://ift.tt/z3TkeK9,1
1,Israel summons Russia envoy over minister&#39;s Hitler comments https://ift.tt/ns0iuGS,1
1,Three Palestinians injured by Israeli gunfire near Ramallah https://ift.tt/BlJRIiQ,1
1,Moscow intimidating Russians in the Netherlands https://ift.tt/7o31Uaz,1
0,I decided to 3D print my favorite video game https://ift.tt/HTXiOzI,0
0,What is your opinion on the best game song/soundtrack ever? https://ift.tt/Ka5fdRx,0
0,How good/ fun is Mighty no.9 compared to the Megaman games? When I was young I played the living hell out of the Megaman games on my NES. Even though I wasn&#39;t great at them (I mean I was 5 years,0
0,The Sony PlayStation - A thing of beauty. https://ift.tt/NzsbE7x,0
0,Name the game I&#39;ll start cyberpunk 2077. https://ift.tt/JqngA6N,0
0,"A Tecmo Story So, it was 1991.. the heydays of the NES. my favorite cousin was excited about Tecmo super bowl coming out. We both enjoyed Tecmo bowl as well. I was 12 years old and he lived with my",0
0,"Star Wars Builder like Civ or Cities How has this not been a thing? Or has it been? Considering the popularity of Sims and Cities, I feel like a creator in the SW galaxy would be huge. Just don&#39;t",0
0,I wonder what games in 3088 will look like https://ift.tt/NUBj5z9,0
0,"I don&#39;t find battle royal games fun, and don&#39;t understand how people that play them, find them fun Now, FYI, If you enjoy those types of games, good for you, this isn&#39;t a post of me saying",0
0,I hope it to be good after the issue with Leslie Benzies and others https://ift.tt/4VYx98a,0
0,"(new) Hive online To the crawling insects of reddit. Bored during job hunting, I coded an online version of HIVE: https://hive-70e06.web.app/ Note that the matchmaking code has not been tested with",0
0,"Gamers in there 40&#39;s what would be a really great nostalgic gift for you? My friend is 42 this year and due to life being crap and an awful divorce he has almost no possessions but the basics, I",0
0,What are some games that involve turning your enemies&#39; allies/armies against them? Similarly to something like Shadow of Mordor and Shadow of War.,0
0,Reuters on Twitter - Square Enix to sell &#39;Tomb Raider&#39; to Sweden&#39;s Embracer https://twitter.com/Reuters/status/1521056929577148416?s=20&amp;t=Oa9C2fRpuOuENJfz3N2hkw,0
0,"Eidos, Crystal Dynamics, Square Enix Montreal to be acquired by Embracer Group https://ift.tt/xWkAJdn",0
0,"Embracer Group enters into an agreement to acquire Eidos, Crystal Dynamics, and Square Enix Montréal amongst other assets https://ift.tt/3hKvij4",0
1,Russian gas deliveries via Ukraine hit 5-month high https://ift.tt/1v9Kyip,1
1,Poland said it had called in the French ambassador to Warsaw after French President Emmanuel Macron insulted the Polish prime minister in an interview with Le Parisien newspaper https://ift.tt/o3ipvc7,1
1,Russian Soldiers Get In a Shootout With Each Other - The Debrief https://ift.tt/p7jrmaH,1
1,"The EU is set to propose a Russian oil embargo, but Putin ally Hungary pushes back: &#39;It makes no sense&#39; https://ift.tt/l26DYqp",1
1,Mariupol steelworks evacuees heading to Ukrainian-held city https://ift.tt/XEN1iKM,1
1,Most Americans support more Russia sanctions and Ukraine aid - poll https://ift.tt/zIF4ed9,1
1,Quarter of Russian battle groups rendered &#39;ineffective&#39; https://ift.tt/PgaYwxI,1
1,"Video shows Ukrainian drone destroying Russian patrol ship off Snake Island, defense ministry says https://ift.tt/qRabfFM",1
1,Israel opens world&#39;s first subterranean missile-proof blood center https://ift.tt/OA7yhqf,1
1,"Germany to invite India, Indonesia, Senegal, S Africa to G7 summit https://ift.tt/3fwYKEH",1
1,Israel lashes out at Russia over Lavrov&#39;s Nazism remarks https://ift.tt/IdT27rC,1
1,More than 3000 civilians killed in Ukraine so far: UN https://ift.tt/jCeYnQU,1
1,Vladimir Putin calls them &#39;scum&#39; and &#39;traitors&#39;. Here&#39;s what life is like for Russia&#39;s new exiles https://ift.tt/hVHP0Zi,1
1,"/r/WorldNews Live Thread: Russian Invasion of Ukraine Day 68, Part 1 (Thread #208) https://ift.tt/1DyMPc2",1
1,Zelensky refutes Russian propaganda claim that Azov Regiment is &#39;neo-Nazi&#39; https://ift.tt/kGCiKI0,1
1,"Israel wants apology after Russia&#39;s Lavrov compares Zelensky to Hitler | &#39;So what if Zelensky is Jewish,&#39; Russian Foreign Minister Sergei Lavrov said in a television interview. https://ift.",1
1,Israel demands apology after Russia says Hitler had Jewish roots https://ift.tt/DCh6RBw,1
0,"Embracer Group Enters Agreement to Acquire Eidos, Crystal Dynamics, and Square Enix Montreal for $300 Million - IGN https://ift.tt/pP0QMqk",0
1,Spanish prime minister&#39;s telephone infected by Pegasus spyware https://ift.tt/6gFZ4QD,1
0,Sensitivity converter for controller Does anybody know a website to convert sensitivity in shooting games. For example call of duty modern warfare to rainbow six siege,0
0,"Hello! This is my first steering wheel (300 RS GT from Thrustmaster). Im looking now for a second screen for my streaming and work. Still miss a second screen, what do you guys recommend? https://ift.",0
0,Sorry for tearing a hole in the space-time continuum :( https://ift.tt/6zpbveB,0
0,I&#39;m in post-game depression. I feel like my gaming year has already peaked. What game can I look forward to for this year? Indoors welcome. https://ift.tt/Hz5F09q,0
0,what are your best memories of the ps2? No text found,0
0,Games released in 2013 to 2015 Games released in that time in my opinion look better than games releasing today Look at ryse look at the order 1886 or ac unity and many more I think in that next gen,0
0,Looking for new games to play on Xbox. What are you all playing? No text found,0
0,"In games with classes, what&#39;s your go to? The usual is normally like: Fighter(warrior), Mage(wizard) or thief(rogue/archer)",0
0,I still can&#39;t beat Mile High Club on Veteran. I just bought the game this year digitally. I&#39;ve been going at this mission for a total of 6 hours now. The furthest I&#39;ve made it was 3/4 of,0
0,Ghostwire tokyo is the most graphically impressive and most boring game I have ever seen... https://ift.tt/Vwn2ved,0
0,need help finding a gaming pc under 800 im looking for a gaming pc for under 800 thats decent. maybe able to run seige at most. i might be able to get my friend to sell me this old graphics cards that,0
0,You are a gaming Chad if you know who wears this shirt https://ift.tt/Zj91Jp4,0
0,"TT Games fix Lego Star Wars! Can we all start spreading the word that Lego Star Wars The Skywalker Saga need a bug fix patch? I&#39;ve encountered so many game breaking bugs. For example, I can&#39;t",0
0,Two number 9&#39;s GTA San Andreas Gangsta edit https://youtube.com/shorts/Z3f6z-I1zAY?feature=share,0
0,A memory just popped in my mind about... Some years ago there was a trailer of a big red rusty robot waking up in a post apocalyptic city covered with nature. The graphics looked insanely advanced for,0
0,A timeline where starbucks is making GTA VI https://ift.tt/q17PwKW,0
0,Gears of War Trilogy Soundtrack https://www.youtube.com/watch?v=NDIlndeUCLE&amp;t=1322s,0
0,Fan made trailer of what The Last of Us remake could look like in unreal engine 5 https://youtu.be/Ke3E5ed1QHg,0
0,"For the people that have ventilation problems with their PS4 system, I might have a solution. Turn off Super Sampling Mode. It greatly reduces the amount of noise the PS4 makes when gaming. It really",0
0,What&#39;s the best trilogy of games? No text found,0
0,Yes indeed those are the same thing https://ift.tt/nRjohSa,0
1,Samsung Electronics union protests against wage hikes https://ift.tt/AESD5Vk,1
1,Goldman Sachs slashes credit exposure to Russia https://ift.tt/K56wlPE,1
1,&#39;We are living in hell&#39;: Pakistan and India suffer extreme spring heatwaves https://ift.tt/W3q5dS0,1
1,Video Appears to Show Russian Convoy With Stolen Ukrainian Equipment https://ift.tt/kh48mIg,1
1,Israel says Iran tried to recruit agents via Facebook https://ift.tt/omlTXSa,1
1,Odesa locks down over fears of Putin&#39;s saboteurs on painful anniversary https://ift.tt/o08U2Ec,1
1,EU anti-fake news agency starts debunking in Chinese https://ift.tt/sRvEA1i,1
1,"Britain will be drowned in radioactive tsunami missile strike, Kremlin propaganda warns https://ift.tt/UiAubV8",1
1,Sisters Recount Perilous Escape From Mariupol as Russians Closed In https://ift.tt/VR8ukQU,1
1,Israel slams top Russian diplomat for suggesting Hitler might have been Jewish: &#39;Jews did not murder themselves&#39; https://ift.tt/CARfmE3,1
1,Putin Won&#39;t Commit to Declaring Victory in Ukraine War This Week https://ift.tt/eO4AKfE,1
1,"EU set to ban Russian oil, ministers hold crisis talks on gas https://ift.tt/5WijcKR",1
1,Italy open to pay temporarily for Russian gas with rubles https://ift.tt/xSYpsv1,1
1,Poland urges EU unity to slap sanctions on Russian energy https://ift.tt/ABhJ1Zz,1
1,Civilians evacuated from Mariupol steelworks but hundreds still trapped | Ukraine https://ift.tt/XEN1iKM,1
1,"Finland will decide to apply for NATO membership on May 12, says Iltalehti newspaper https://ift.tt/T2SAH4j",1
1,Russia&#39;s Lavrov says May 9 not a relevant date for Ukraine operations https://ift.tt/64FlPSI,1
1,World&#39;s First Country Announces a Temporary Halt of the COVID Vaccination Campaign https://ift.tt/NGRCya6,1
1,Germany pledges 10 bln euros for bilateral cooperation with India https://ift.tt/jtyhJL9,1
1,Russian Explosives Plant Fire Kills 2 - The Moscow Times https://ift.tt/BeQv31r,1
1,Fennovoima pulls the plug on Russian-built nuclear plant https://ift.tt/spAaYKz,1
1,Russia&#39;s chief propagandist threatens to &#39;plunge UK into depths of the sea&#39; https://ift.tt/0hSq3yd,1
1,Hungary has announced they will block any EU sanctions on energy against Russia. https://ift.tt/eZcR2lW,1
1,Fennovoima has terminated the contract for the delivery of the Hanhikivi 1 nuclear power plant with Rosatom https://ift.tt/CkAL3Yh,1
1,Israel lashes out at Russia over Lavrov&#39;s Nazism remarks https://ift.tt/TGWLRey,1
1,"Putin set for cancer surgery, to hand over temporary power to ex-KGB chief https://ift.tt/x97z2EV",1
1,"Israel reacts with fury at Russia over Lavrov&#39;s remarks on Hitler, Nazism https://ift.tt/lZFuDAj",1
1,Ukrainian evacuee recounts terror in the bunkers of Azovstal https://ift.tt/vBijlGm,1
1,Spanish PM&#39;s phone tapped with Pegasus spyware https://ift.tt/MwAe1Rm,1
1,Spanish prime minister&#39;s phone &#39;targeted with Pegasus spyware&#39; https://ift.tt/TWmFQEY,1
0,This mf with the door… https://youtu.be/EaJj4cJ6hjg,0
0,"AskGaming: What game(s) has the most victory conditions? Lots of games have alternate endings, but I&#39;m talking victory conditions. Consider a round of Civilization 6 where you can win from",0
0,what is the best console to take on the road? bout to take my career across the country and code from a van what console should i bring in the van for gaming,0
0,In Defence of Overwatch 2 https://youtu.be/2yZAT0bdKFM,0
0,Does this mean the other versions are &#39;Incomplete Editions&#39;? ​ https://preview.redd.it/pwdxqemfg8x81.png?width=412&amp;format=png&amp;auto=webp&amp;s=33ab0df2a88d202ca3b41a8ee29e9e6a0c668ef7,0
0,Real Steel 360 fight night Anyone have Real Steel on 360 and want to have a ranked fight night? Legit don&#39;t know if the servers work but the DLC shop still loads so I&#39;m hopeful,0
0,"Need a good story game Just got positive for covid so need a game to keep me entertained. Enjoy story games like, Red dead 2 GTA 5 Days gone Any recommendations for games like these?",0
0,"Be bad,get talked shit,be good,still get talked shit. https://ift.tt/cqx0TuB",0
0,played minesweeper in Google play and then it broke? https://ift.tt/69YX0ep,0
0,Framed my favorite Yugioh card for display https://ift.tt/4kJ5Eod,0
0,I like crossovers and own a 3D printer. https://ift.tt/IJgvSfb,0
0,"Does this mean if I download Naraka Bladepoint, I will always play it for free, or I have to buy it after May 4? https://ift.tt/NJXVWLi",0
0,Ghost recon future Soldier low fps All in game graphics setting are set to low. Guerrilla mode works fine but campaign gives me like 5-10fps. Any help appreciated.,0
0,Got something that might interest you. https://ift.tt/5V1gpL3,0
0,GTA VI needs to incorporate skateboarding Using a bicycle to get away from cops was entertaining and also a challenge. I think it&#39;d be cool to add skateboards! This could also possibly invite,0
0,Got 20 bucks. What ps4 game should I buy? No text found,0
0,All modern games are TRASH Fuck modern games. They&#39;re all TRASH. GARBAGE. period. Even indie games are trash and the only reason I&#39;m calling indie games trash because I&#39;m a biased boomer,0
0,Trying to remember the name of a sci fi gun based roguelike I faintly remember watching a review of some sci fi gun based roguelike ages ago that had a heavy focus on upgrading its guns. It wasn&#39;t,0
0,"I finally get it (Guardians of the Galaxy)... ...I finally understand the posts about how good it is. I finally have been able to play it, and holy s*** ... I just want to yell about how f***ing fun it",0
0,"The Warriors How many people in this group have played this ps2 game? Also, tell me your greatest memories within this masterpiece.",0
0,There are cute girls in this Video | Valorant https://youtu.be/-r9lT6o5VRI,0
0,1080p low settings or 720 ultra which is better? No text found,0
0,"whats your best feat in a videogame doesn&#39;t have to be something huge or crazy cool. just something you wanna share, or maybe your cool story about that thing you once did.",0
0,"You are given a task to apply one part of a video game, into another. What combination will you make? To be more clear have an example. Dying Light&#39;s gameplay in Skyrim&#39;s World. or Mass Effect",0
0,my Tito keeps telling me how he was shocked that cj did not die https://ift.tt/cnsikgr,0
0,Cyberpunk 2077. Actually enjoying this game. Really immersive. It&#39;s no Witcher 3 but it&#39;s pretty damn good so far. At the start of the heist right now.,0
0,"If you had to choose 4 favorite games of all time, what would they be? Here are mine in order. https://ift.tt/K3PjSoI",0
0,"Why is RDR2 seen as such a feat in gaming animation when games like The Last of Us, Until Dawn, and Uncharted 4 exist? I&#39;ve just heard from so many different sources that RDR2 made waves for its “",0
0,"Fun Fact: Gran Turismo 7 is the first GT game ever to be released on a “last gen” console. Prior to this release, it was only on the newest console at the given time. https://ift.tt/alHRyhr",0
0,Just bought horizon zero dawn. Thoughts on the game? No text found,0
0,"Need help finding an old game. So, this was probably around 2008 or so, I believe the creator of Anodyne, a pixel art Zeldalike, had made a metroidvania style platformer with a similar name to Anodyne.",0
0,don&#39;t you think they are just pushing coc a lot!..I don&#39;t understand the need for this new update ...coc just doesn&#39;t feel that fun anymore! No text found,0
0,"Should a 4 year old child be allowed to play GTA5, unsupervised, for hours at a time? Also curious about the psychology behind it Now, I (21M) am not a grandma that thinks violent video games will turn",0
0,Bang! https://youtube.com/shorts/dS3xRV8KgYc?feature=share,0
0,"Should I buy a nintendo or save money for a gaming PC? Hi there, I&#39;m 22 years old. Since my childhood, I wanted a gaming console like PSP or PS Vita. But we couldn&#39;t afford it at that time. I",0
0,Blessing you with some TLOU VP :D https://ift.tt/CFZdmzU,0
0,"I use a laptop, so does buying an external SSD makes the game faster? So this is the issue, i tried playing genshin impact on my laptop, and it literally sucked as hell, they were so slow and lagged a",0
0,Yo I have a question on the keyboard for this specific model. For the Alienware M15 R7 gaming laptop (Intel option) for the first keyboard option doesn&#39;t specify if the keyboard is backlight at all,0
0,"What advices can you give as a game server moderator? So I&#39;m recently running a dedicated game server by myself, and It&#39;s my first time doing it so I don&#39;t really have much experience on",0
0,Guess what game this is from. https://ift.tt/WxOA6DC,0
0,Help finding a game. I&#39;m like 80% sure this game was on ps 2. So the opening scenes to start the game show a boy and a girl on a small ship in a stormy sea. They get attacked and the boy tell his,0
0,I decided to make 2 carnival themed tables for my pinball game! https://youtu.be/DZfIpWkarhk,0
0,"Bruh i bet that the graphics cards u be getting rid of are more powerful than mine by like ………. A lot comment your old one, let&#39;s see. No text found",0
0,When the Kyoto animation tragedy happened back in 2019 I thought why wasn&#39;t screw attack or any of the major gaming outlets even covering this tragedy especially considering how most of us who are,0
0,Nintendo Switch Sports Accessories Review! https://www.youtube.com/watch?v=gaf4cCDd9bA,0
