Category,Message,real
0,which is a better sequel. Titanfall 2 or doom eternal Me personally I like eternal more because it had more single player ai combat content.,0
0,Low poly / low quality animals needs separate fanpage https://ift.tt/yuLiBgw,0
0,Can someone help me find this game? I don&#39;t know where else to ask. There&#39;s an old game.. think it came out in 2007 or 08 called Bipo: Mystery of the Red panda. Wondering if anyone knows where,0
0,Do you need VRR for 120 fps games? I don&#39;t have VRR support but I got 120 FPS on my PS5.,0
0,Hmmm. Looks a little familiar. https://ift.tt/tbYMxXg,0
0,"Anyone else remember these three Scooby-Doo Gamecube games? These were my entire childhood, and they&#39;re honestly still just as good to this day. Way ahead of their time https://ift.tt/PAg7Ney",0
0,which sounds like a better MMORPG concept? Naruto or Avatar last Airbender So we had this debate amongst friends to see which would be a better open world multiplayer online game. A Naruto based game,0
0,Moving from Australia to England. Will PS5 Work? Hi there! I am moving from Australia to England and want to bring my Australian bought PS5 to the UK. In regards to it functioning over there will it be,0
0,battlefield 2042 shotgun work ^_^ https://youtu.be/ey16CFTM2wI,0
0,"Literally did everything in the game (through bugs, glitches, and crashes) only to be locked out of 100%. https://ift.tt/RbqLMlK",0
0,"What are good 3ds games? I was considering getting a new 3ds game, any suggestions? Btw so far I have Mario Maker, Monster Hunter 3, Bionicle Heros, and Xenoblade.",0
0,Good ol&#39; Mass Effect 2 reminder for those mates out there https://ift.tt/usdpwTA,0
0,My night will be normal (I hope) https://ift.tt/5jvoIh7,0
0,Is the persona 5 game on the ps4 and switch the same? It has a different name but is the concept the same? No text found,0
0,Buying SSD was a good decision. https://ift.tt/jCcBINa,0
0,New Game + Do you prefer to do a new game+ or start from scratch again for a second play through? For example playing God of War again after beating a few years ago and I like starting from scratch as,0
0,What game do you state that you enjoy and people call you shit for? https://ift.tt/soaUvKy,0
0,Vertical mounting https://youtube.com/watch?v=zdddslk7Fvs&amp;feature=share,0
0,You have GOT to see what this guy did on CS:GO https://www.youtube.com/watch?v=6dQEafBO15g,0
0,The most beautiful tribute to the best game ever made https://www.youtube.com/watch?v=c_FujTio-4c,0
0,Crazy Shortcut in Super Mario Kart SNES https://youtube.com/shorts/pXg4iPTDuSg?feature=share,0
0,"I&#39;m gonna get heat for this but, why do people genuinely bash on all AAA games and just throne some random indie game? This question came about when I was asking this reddit what game I should buy",0
1,*angrily munches on broccoli* https://ift.tt/xWkgbjo,0
0,I cannot time the boost-slide-jump in Metroid Dread (Edited for actually adding context) So I&#39;m in Cataris and I have the Speed Boost ability. I&#39;m trying to get the missle tank upgrade just to,0
0,ive gotten to old to game So ive been gaming since atari ive beaten more than a dozen nintendo games about 100 ps1 and 2 games.Every fallout except for the first (never played) Witcher 2 and 3. Getting,0
0,Job Games I dont understand why the hell theres developers and a market for &quot;games&quot; that are literally just a work simulator i mean if you really think all games are just time wasters but i,0
0,"Why yes, this IS just an excuse for me to post my favourite games https://ift.tt/FfkLsBg",0
1,"Lithuania recognises war in Ukraine as genocide, Russia as terrorist state https://ift.tt/MeKj9nF",1
1,Spain sacks spy chief amid Pegasus scandal: reports https://ift.tt/wcqLJFB,1
1,Construction of the world&#39;s largest offshore wind farm has begun https://ift.tt/sLHkmwK,1
1,"Bongbong Marcos, son of dictator Ferdinand Marcos, projected to win Philippine presidential election https://ift.tt/HxKtJMv",1
1,Bonnie and Clyde Shown Among Photos of Russian WW2 Veterans on Victory Day https://ift.tt/cWV8Rn2,1
1,Lithuania recognizes Russia&#39;s actions in Ukraine as genocide https://ift.tt/cHvOCGe,1
1,EU drops plan to ban tankers moving Russian oil to third countries https://ift.tt/XIpCz23,1
1,"Honduran ex-president to plead not guilty to US drugs, weapons charges https://ift.tt/041hO5c",1
1,"Five Killed, Over 200 Injured As Political Clashes Spread in Sri Lanka https://ift.tt/yhBRa9J",1
1,The stolen faces used to promote Vladimir Putin https://ift.tt/uBVHqnC,1
1,China is tightening pandemic restrictions in Shanghai and expanding mass testing in Beijing https://ift.tt/uy81oUV,1
1,"Boots, Superdrug and other chemists report hay fever pill shortages https://ift.tt/c8QDom1",1
1,Israeli soldiers beat Palestinian journalist documenting West Bank demolition https://ift.tt/VuMzGZE,1
1,"Biden is furious about the leaks saying US intelligence helped Ukraine kill Russian generals and sink its warship, report says https://ift.tt/dsXrzJ2",1
1,"Marcos, Duterte new Philippines president and vice-president https://ift.tt/tEBOhJQ",1
1,"Lithuania recognises war in Ukraine as genocide, Russia as terrorist state https://ift.tt/MeKj9nF",1
1,Russia pounds Odesa as civilian bodies uncovered elsewhere https://ift.tt/HPhdiQN,1
1,&#39;Meet us before you reject us&#39;: Ukraine&#39;s Roma refugees face closed doors in Poland https://ift.tt/q8WQIde,1
1,Pulitzer Board Honours Ukrainian Journalists Covering Russia&#39;s Invasion https://ift.tt/iPjvKRJ,1
1,Russian oil tycoon was found dead after reportedly being treated with toad venom to cure a hangover https://ift.tt/zIvgTe5,1
1,Elon Musk fears for life after Russian threat https://ift.tt/zWokSOZ,1
1,China says G7 concern over Hong Kong leader selection is interference https://ift.tt/w63vD02,1
1,Protests break out as Philippines election returns a Marcos to presidency https://ift.tt/McgxLKw,1
1,China&#39;s Xi tells German Chancellor all efforts must be made to avoid Ukraine conflict from intensifying https://ift.tt/Iuwg20a,1
1,Putin tells experts to work on trade payments with allies and &quot;unfriendly&quot;; states https://ift.tt/FjQVh2y,1
1,US refutes claims that Ukrainian civilians are going to Russia willingly https://ift.tt/gJTRHw1,1
1,Israeli basketball fans attacked by pro-Palestinian protesters in Spain https://ift.tt/BxtYXz6,1
1,How Russia&#39;s war in Ukraine is changing the world https://ift.tt/se2opZP,1
1,Troops rescue outgoing Sri Lanka PM as houses torched in deadly night of unrest https://ift.tt/aUZltE4,1
1,Russians pushed back from Kharkiv but continue their attacks https://ift.tt/lJNLixU,1
1,"For French Military, War in Ukraine Prompts a Shift in Focus https://ift.tt/73AqXdv",1
1,"Downed Russian fighter jets are being found with basic GPS &#39;taped to the dashboards,&#39; UK defense minister says https://ift.tt/SdfRx20",1
1,OPEC Kingpins Sound Alarm Over World&#39;s Dwindling Energy Capacity | Financial Post https://ift.tt/2PV10iM,1
1,Ukraine&#39;s Economy to Shrink 30% This Year Due to War https://ift.tt/A9h6YXq,1
1,Ukraine&#39;s Odesa douses fires after Russian Victory Day strikes https://ift.tt/wj9xLAX,1
1,&#39;Paranoid dictator&#39;: Russian journalists fill pro-Kremlin site with anti-war articles | Russia https://ift.tt/439vpGw,1
1,Chinese Mining Giant Wanbao Fears Myanmar Resistance Attacks https://ift.tt/Q7Gm14V,1
1,South Korea Inaugurates Yoon Amid Growing Threat From the North https://ift.tt/Qo6VziU,1
1,"Marcos Jr. wins Philippine presidency by landslide, unofficial count shows https://ift.tt/zLb9sth",1
1,"Lanka Ex-PM, Family Flee To Naval Base, Surrounded By Protesters https://ift.tt/Qdc7kyL",1
1,Top five Russian propaganda WWII myths debunked https://ift.tt/7nvBY5w,1
1,Crowdsourcing a War: How Online Appeals Are Bringing Weapons to Ukraine https://ift.tt/3ltrc2S,1
1,German Foreign Minister Baerbock arrives in Ukraine https://ift.tt/iowTQDZ,1
1,"US Edits Its &#39;US-Taiwan Relations&#39; Page, Removes Sentence &#39;Taiwan Is Part Of China&#39; https://ift.tt/gJMCh9t",1
1,Biden says he is worried Putin does not have a way out of Ukraine war https://ift.tt/DWEKFgf,1
1,China&#39;s pro-Russia propaganda exposed by online activists https://ift.tt/0OCszha,1
1,"Crucial NATO decisions expected in Finland, Sweden this week https://ift.tt/dvE63mf",1
1,"Russia fires hypersonic missiles at &#39;tourist infrastructure&#39; in Ukraine, officials say https://ift.tt/Bi7Xp0q",1
1,Russian journalists flooded their pro-Kremlin news site with anti-war headlines on Victory Day https://ift.tt/gIrV5EO,1
0,Nepali scales Mt Everest for record 26th time https://ift.tt/fAzbl1I,1
1,Protests break out as Philippines election returns a Marcos to presidency https://ift.tt/dhRBNUx,1
1,India Orders VPN Companies to Collect and Hand Over User Data https://ift.tt/g8DAmfa,1
1,Rajapaksa family&#39;s ancestral home set on fire as violence claims 8 lives in Sri Lanka https://ift.tt/EsQOZpd,1
1,Russian forces committing war crimes and atrocities in Ukraine: US https://ift.tt/3B20GOs,1
1,G7 flags rights concerns in selection of new Hong Kong leader https://ift.tt/lk9Jiap,1
1,Ikea continues to purchase Russian lumber. https://ift.tt/b52c7kx,1
1,Australian police find cocaine worth $14 million near body of diver https://ift.tt/GEupZar,1
1,Is the Shanghai lockdown really about COVID? https://ift.tt/gPOdkVW,1
1,US state department updates fact sheet on Taiwan ties - Taipei Times https://ift.tt/isIKn08,1
1,Kremlin forces strike Ukraine&#39;s Odesa with missiles after Russia celebrates Soviet victory in WW2 https://ift.tt/wj9xLAX,1
1,Ukraine mocked Russia&#39;s &#39;Victory Day&#39; by holding a &#39;parade&#39; of captured Russian tanks https://ift.tt/GIYy3aj,1
1,Groups protest &#39;unjust&#39; election process in the Philippines https://ift.tt/vO4k2ni,1
1,"EU industry chief Breton, Musk signal agreement on Digital Services Act https://ift.tt/r7jWSV0",1
1,Arctic temp anomaly to be over three times as large as global mean anomaly https://ift.tt/PFd1R6a,1
1,Pediatricians Hold the Front Lines of a Mental Health Crisis https://ift.tt/xKfewZQ,1
1,Finland is on the verge of asking to join NATO. Here&#39;s why that&#39;s bad news for Putin. https://ift.tt/9vWld1I,1
1,History to hold Russia responsible: Volodymyr Zelenskyy https://ift.tt/G8NXTRF,1
1,Ukraine upgrades war aims as confidence grows https://ift.tt/fc8Ly9Z,1
1,Missiles pound Ukraine&#39;s Odesa after Russia marks WWII victory https://ift.tt/KNd74aq,1
1,Spy chief suggests Chinese officials are increasingly feeding information to Australian agencies https://ift.tt/ZofNAHS,1
1,Police round up hundreds of Palestinians in Israel illegally after Elad attack https://ift.tt/IObFV0i,1
1,Russian shelling damages Jewish cemetery in Ukraine where pogrom victims are buried https://ift.tt/SZf0lLx,1
1,Knesset approves NIS 500000 compensation for each Meron disaster victim https://ift.tt/TfmVct9,1
1,"Marcos Jr. won Philippine presidency, unofficial count shows https://ift.tt/Sxhejs5",1
1,"Severe heat wave kills dozens in India and Pakistan in a &quot;snapshot&quot; of what&#39;s to come from climate change, expert says https://ift.tt/DVicJr5",1
1,German airline Lufthansa bars Jews from boarding flight https://ift.tt/8cyrAlL,1
1,Democrats to propose $39.8 billion in Ukraine aid not linked to Covid aid https://ift.tt/v6sKETQ,1
1,First Dutch volunteer fighter killed in Ukraine https://ift.tt/U4j7lXr,1
1,Zelenskiy calls for end to blockade of Odesa port to prevent global food crisis https://ift.tt/NocsnHI,1
1,Republicans Will Tank the Economy to Force Women to Give Birth - https://ift.tt/mj5kQI4,1
1,Japan announces fresh economic sanctions against Russia https://ift.tt/pFPMTfn,1
1,Sri Lanka: Protesters torch leaders&#39; homes in night of unrest https://ift.tt/ZdD2QJe,1
1,Monkeypox virus case confirmed in UK after Nigeria travel link https://ift.tt/rAKCmsB,1
1,Protest in Comelec Manila over poll results of Bongbong Marcos leading presidential election https://ift.tt/IuC3Rea,1
1,Teen Ukrainian math geniuses to study in Israeli university https://ift.tt/3qsn2F8,1
0,"VALORANT patch 4.09 notes: Chamber nerf, Fade VFX changes, more https://ift.tt/j84AsNe",0
0,Anyone ever play the Moon Eater game on floppy disk from Taco Bell? https://ift.tt/OUdcwj5,0
0,how can i play half life 2 with PlayStation 3 UI No text found,0
0,"GOTHAM KNIGHTS is coming this year, October 25th. It&#39;s also updated as a next-gen exclusive (PS4 and XBox One versions are officially cancelled). https://ift.tt/1KA9QWD",0
0,What are your favorite cooperative games? My wife and I enjoy cooperative games a lot like Overcooked and It Takes Two. We&#39;re wanting to see what else is out there to try! We have a Switch and Xbox,0
0,"Anyone remembers FIFA World? Context: FIFA World was a game around 2013 that was basically a free FIFA, made by EA and it was close to the real deal, and as a broke kid, i was obbsessed by it. It was",0
0,Game made for a Game Jam some time ago https://ift.tt/6DujCP9,0
0,&quot;No sight of the target&quot; - Worst Hitman Guard https://youtu.be/_TljZ8EhU7g,0
0,what are some good games to play? I am currently playing toys but it&#39;s kind of getting boring now what are other good games preferably free ps: i have already played fortnite/apex,0
0,Only the real ones know what this is. https://ift.tt/C7F0RwA,0
0,"Pokemon Arceus vs Brilliant Diamond/Shining Pearl So I&#39;m kind of wanting a new Pokemon experience. In your opinion, what&#39;s better between these? Arceus or BD/SP? Or would it be better to wait",0
0,Launch Release Lighting Patch v1.02 https://ift.tt/bmLViex,0
0,"Iron Fist Alexander the living jar, the best boy. (Fan art by me) https://ift.tt/IBk0ba7",0
0,That&#39;s just what good squad mates do https://ift.tt/3WgkPiE,0
0,I assume next gen consoles won&#39;t be affordable for quite some time? No text found,0
0,Will this pass as a Gothic 1 Old Camp Guard Costume? https://ift.tt/D1EdzNk,0
0,"WSIB Open World with rewarding free roam. I genuinely am obsessed with games like Monster Hunter, BoTW, The Long Dark, and I&#39;m looking at getting Horizon Zero Dawn. My preferred platform is Xbox",0
0,We made some original creations for celebrating the one-year anniversary of Resident Evil: Village. (Butrix Production). https://youtu.be/1N-zYI35Guk,0
0,thinking of Halo specifically https://ift.tt/AUhwXlC,0
0,"save me reddit, what game is this, i took this ss, and its the only one i have from this game but i cant remember the name now lol https://ift.tt/MjOHu0w",0
0,"Need help finding a game There&#39;s this game I would play with my friend six years ago, I don&#39;t remember which console we would use I only remember it was white. The game itself was multiplayer",0
0,"Elden Ring open world benchmark comparisons Playing through ER - love it, huge fan of fromsoft games. A common criticism of the open world is that there&#39;s a lot of repetition with the mobs - re-",0
0,Search for a database of video game essays No text found,0
0,"Parents, Young Gamer Communities? Hello Reddit My little one at 4 years old has been incredibly into gaming since getting his Nintendo switch for Christmas, so much so he&#39;s virtually taken over my",0
0,What&#39;s a game you regret buying or playing? No text found,0
0,Sell me on a Nintendo switch I keep seeing them in the stores and it&#39;s as if they are begging me to be buy them. On top of that I did skip the Wii and all their later handheld systems. This,0
0,"Why is there not a good open world Pokémon game, or did I miss it? I&#39;ve been replaying Red Redemption 2 and it seems that this same platform would be prime for a Pokémon type with an open world",0
0,"Rpg gamesss? Hey! I (18F) am looking for a cool rpg game to play! I already play Elder Scrolls and Genshin Impact. I really want to try something new, and would love to hear your recommendations! I",0
0,a couple of &quot;Elden Ring&quot; paintings i made https://ift.tt/ajwye73,0
0,"Waitventure, an idle RPG with monster recruiting, fusions and time control https://ift.tt/NPy17K5",0
0,Breaking bad in the style of a GTA 5 loading screen https://www.youtube.com/watch?v=gib5R-t-nx8,0
0,"When I was 6, I went on an adventure. https://ift.tt/KRG8wi3",0
0,I just want to play Watch_Dogs That series is too expensive for me. Is there someone generous enough to share their steam account (that has Watch_Dogs series) to me? Is this even legal tho? Or,0
0,Hit so hard I was knocked into photo mode https://ift.tt/beKgfP5,0
0,"Online matches are all stomps anymore My online gaming diet recently has consisted of alot of Battlefield 1, Star Wars BF2, MCC, and Halo Infinite. I really enjoy all these games, but online is just",0
0,Just think about this. In nearly 10 years we have only had 1 GTA game. No text found,0
0,Nintendo&#39;s Latest Financial Report Reveals Mario Party Superstars Is On Track As Best Selling Entry https://youtu.be/IuDMbCFxWbc,0
0,Cyberpunk 2077 Fan art - WIP just learning how to draw/paint https://ift.tt/mA2c4xC,0
0,Formula Drift in Virtual Reality on Assetto Corsa https://www.youtube.com/watch?v=kLK1WpC3_gk,0
0,Nintendo Sold More Games Than Ever Before Last Year https://ift.tt/dxPaIR7,0
0,"Fourth Wall Studios - Much like the game we&#39;re in, we are very broken. https://ift.tt/VAei47n",0
0,"Cheap places to buy games AUS I&#39;m in Australia, what place sells nintendo switch games cheap?",0
0,"What are some of your least favorite games of all time? I mean absolutely awful games. Games so bad you couldn&#39;t even bring yourself to finish, you just had such a bad time playing these games.",0
0,Ghost of Tsushima Director&#39;s Cut: Patient Gamer Review https://youtu.be/jJ8Uh1HzrQU,0
0,"This is the first game I&#39;ve ever made! If you like retro arcade platformers, check it out. https://ift.tt/Nen9AoP",0
0,I have a question I played a lot of games people say are 10/10 or just good in general but the only games i ever completed have been skyrim and undertale and i didnt really enjoy anything else that,0
0,Explain why you&#39;re anticipating current upcoming video game releases. Stray - I adore puzzle games and cats so I feel that this will offer something unique out of the sea of same. Mario + Rabbids:,0
0,“Disturbing” PC Games? Any pc games that are disturbing? Not exactly like typical horror games but something that leaves you with a disturbing after taste. Similar to Junji Ito mangas like his work of,0
0,Forgot name of popular FPS game It&#39;s about an apocalyptic world where alien like creatures have taken over. You are a modified human. By modified human i mean like you are a human but have a suit,0
0,"What is the easiest fromsoftware game? Dark souls 1, 2, 3, Bloodborne, Sekiro, Demon Souls Remake, or Elden Ring?",0
0,Honestly exactly what I think whenever I play online https://ift.tt/Xra4dRn,0
0,"Looking for some enjoyable Mobile games I mostly play pc games, survival games mostly. I recently got into diablo 3. I&#39;m really enjoying it and was wondering if there are any good pc games like",0
0,PS5 still missing simple features... Cant talk about it on PS5 sub Got shadowbanned for even mentioning this not sure why. But after all this time there are still super simple features missing from ps5,0
0,Duke Nukem Forever Leaked 2001 Build - Hollywood Holocaust https://www.youtube.com/watch?v=qC6rLI_hF-A,0
0,"The UE5 train station video, non-potato edition (original upload afaik) https://www.youtube.com/watch?v=2paNFnw1wRs",0
0,Pokemon Main Series Games by Sales according to Joe Merrick of Serebii https://ift.tt/XxqeUcw,0
0,"Which game should I get? (25€ budget) So I&#39;ve been wondering which game I should get, I have a small budget for now, and I&#39;m split in between 2 games, Grand Theft Auto 5 or Foxhole, I&#39;ve",0
0,"Guys, GUYS! Sega DO what Ninten DON&#39;T! It&#39;s so true. 🎶Segaaa🎶",0
0,Wait or not / why? Should I wait for the 40 series to come or upgrade in 2 months from a 1080 Ti to a 3090 Ti? Can you help me and list me your reasons?... &gt; For 4k ultra settings single player,0
0,When you somehow failed a simple platform puzzle https://youtu.be/xB5rhpbH2yE,0
1,Researchers investigate cost-effectiveness of mass Covid-19 testing https://ift.tt/6Lg4YjI,1
1,"Two Russian journalists appear to defy Putin, slamming the war in Ukraine https://ift.tt/lSeuKPE",1
1,UN seeks $144 million to offload decaying Yemen oil tanker https://ift.tt/vapM6Px,1
1,"US State Department edits Taiwan fact sheet, angering Beijing for &#39;hollowing&#39; one-China policy https://ift.tt/Tz3p2Bo",1
1,Russian Soldiers Left Ukrainian Man&#39;s Dead Body in Car Trunk With Mine: Politico https://ift.tt/gGNznxK,1
1,"Marcos, Duterte new Philippines president and vice-president https://ift.tt/houGEIR",1
1,Lockdown orders issued in Pyongyang due to &#39;national problem&#39;: Source https://ift.tt/9F3GMsH,1
1,Chinese Car Factory Probed for Reportedly Causing Nosebleeds in Hundreds of Children https://ift.tt/phXz89y,1
1,Finnish Parliament&#39;s defence committee recommends NATO membership https://ift.tt/1MdENiF,1
1,Boris Johnson to sign defence deal in Sweden on Wednesday https://ift.tt/9AYjqtG,1
1,Mysterious Acute Hepatitis Outbreak Claimed 5 Fatalities in Indonesia - 15 Others Have Been Infected https://ift.tt/3oI0hqi,1
1,"Time is now to future proof the land, world leaders say at Abidjan Summit https://ift.tt/36RDqrc",1
1,"IBM unsure how long it will keep Russia-based staff on payroll, CEO says https://ift.tt/cfK8kYQ",1
1,"Shanghai&#39;s Cases Fall, but China&#39;s Restrictions Tighten https://ift.tt/UIeMKZ2",1
1,"There&#39;s Genocide in Tigray, but Nobody&#39;s Talking About it https://ift.tt/WVbeA9K",1
1,Russian envoy to Poland hit with red paint at war cemetery https://ift.tt/0sMkqJn,1
1,Mysterious series of deaths among Russian oligarchs https://ift.tt/Si9Qfkl,1
1,China surprised by Russia&#39;s military failures in Ukraine: CIA director https://ift.tt/jWpFBND,1
1,"Joining Nato best solution for Finland&#39;s security, defence committee says https://ift.tt/OBXkaTR",1
1,"Russia to help ally Belarus create Iskander-type missile, Lukashenko says https://ift.tt/CsnEUy2",1
1,Putin demands action on Siberia forest fires threatening lives and economy https://ift.tt/LlY0Vab,1
1,Ukraine hails &#39;turning point&#39; after Germany toughens stance on Russia https://ift.tt/mS7R2dO,1
1,Future Remains Cloudy for Exiled Myanmar Journalists in Thailand https://ift.tt/bGk9IVH,1
1,"Main Intelligence Directorate of the Ministry of Defense of Ukraine: &quot;Grain stolen from Ukraine is already in the Mediterranean sea. The most likely destination is Syria. From there, grain can be",1
1,China rebukes US for changing Taiwan wording on State Department website https://ift.tt/igPySuE,1
1,Frontline residents in Ukraine hold out hope for peace https://ift.tt/Fq4tXaE,1
1,"Putin sacked the FSB and put the secretive GRU spy agency in charge of Ukraine intelligence after a string of failures, top Russian journalists say https://ift.tt/54yC9b8",1
1,Readers ask: How are public services operating in Ukraine? https://ift.tt/NrvzZGO,1
1,Egypt arrests 13 teenage boys for harassing women tourists at Cairo&#39;s Giza Pyramids https://ift.tt/IwnvEBP,1
1,World Health Organization members pass resolution against Russia https://ift.tt/xNYZPso,1
1,Elon Musk Says Twitter Will Comply With EU Content Rules After Takeover https://ift.tt/KPRzmaF,1
1,Ferdinand Marcos Jr on cusp of winning landslide in Philippines elections https://ift.tt/DWF60An,1
1,The Inevitable Decline Of Russia&#39;s Oil Industry https://ift.tt/PoXCtbm,1
1,"Ukraine has upgraded its war aims as confidence grows, says foreign minister https://ift.tt/ayisj0d",1
1,Marcos Win Prompts Protests in the Philippines https://ift.tt/x7niVhE,1
1,Russia fires barrage of hypersonic missiles at Odesa after celebrating patriotic holiday https://ift.tt/Ql4a9LY,1
1,How much of Ukraine does Russia hold? https://ift.tt/sv5QpRM,1
1,"Philippines election winner Marcos tells world to judge him by actions, not family&amp;#x27;s past https://ift.tt/dhRBNUx",1
1,Germany saw more politically motivated crimes in 2021 https://ift.tt/ZFyBQ6e,1
1,&#39;They are really on the last breath&#39;: The wives of soldiers in Mariupol plead for help. https://ift.tt/Huc8klb,1
1,Australian police find cocaine worth $14 million near body of diver https://ift.tt/WuIVq4x,1
1,"Ukraine war may be causing rise in dolphin deaths, say scientists | Turkey has recorded rise in strandings across its Black Sea coast since beginning of Russian invasion https://ift.tt/cYl5u7j",1
1,Saudi Arabia outlines plan to annex half of Yemen: Report https://ift.tt/It0oJmU,1
1,Head of the British Army says that it &#39;is too small&#39; https://ift.tt/1vfJaNi,1
1,Why Russia has suffered the loss of an &#39;extraordinary&#39; number of generals - ABC News https://ift.tt/VyrNCmA,1
1,Finnish minister tells CNN Nato membership &quot;highly likely&quot;. https://ift.tt/qkWhi0L,1
1,Putin urges stronger action to prevent wildfires https://ift.tt/AcBz49d,1
1,Ukraine mocked Russia&#39;s &#39;Victory Day&#39; by holding a &#39;parade&#39; of captured Russian tanks https://ift.tt/BHQawAZ,1
1,Lufthansa Under Fire After Banning All Jews on Flight Due to Several Unmasked Jews https://ift.tt/GfdOWwp,1
0,"The Best snow levels I have a unintentional love for snow levels, maybe it&#39;s the music, the atmosphere, or the amazing aurora some can have. I want to know your favorites, for me, it&#39;s Sylvalum",0
0,Okay Jeffery. I mean OG Loc. https://ift.tt/HCMniB6,0
0,"Has Phantasy Star Universe Ambition of the Illuminus a endgame? I want to play it on my PS2, what happens after i beat the last mission available? Is my Character getting deleted or can i continue",0
